,title,headers,text,date,link
13,"China's coronavirus hit airline stocks, travel industry braced for fallout - NZ Herald","nzherald.co.nz. . . China's coronavirus hit airline stocks, travel industry braced for fallout. . . . . . . ."," Aviation, tourism and energy writer for the NZ Herald Air New Zealand says it will take the lead from health authorities in any response to the coronavirus which is spreading from China and has been likened to the Sars outbreak in 2002 that temporarily                         $5
$
2.50
per week Already have an account?
Sign in Eligible newspaper subscribers, find out
how to activate your digital subscription T's and C's apply. Subscribe now and get 50% off for the first 8 weeks $5","Jan 21, 2020",https://www.nzherald.co.nz/business/chinas-coronavirus-hit-airline-stocks-travel-industry-braced-for-fallout/4ICXKFQWMA7OOTIG2K6URPZKT4/
14,"US STOCKS-S&P 500, Nasdaq hit record on IBM, waning China virus fears | Reuters","US STOCKS-S&P 500, Nasdaq hit record on IBM, waning China virus fears. . . . . . . . .","Discover Thomson Reuters By Sruthi Shankar 3 MIN READ (For a live blog on the U.S. stock market, click or type LIVE/ in a news window.) * IBM shares jump on strong forecast, earnings * Chipmakers rise after upbeat ASML outlook * J&J slides after disappointing FY profit forecast * Indexes up: Dow 0.29%, S&P 0.36%, Nasdaq 0.54% (Updates to open) Jan 22 (Reuters) - The S&P 500 and the Nasdaq scaled new highs on Wednesday, as an upbeat forecast from IBM added to optimism over earnings, while China’s efforts to contain a virus outbreak eased worries about a wider financial fallout. International Business Machines Corp shares jumped 4.1% after it forecast full-year profit above market expectations on strength in its high-margin cloud computing business. Technology stocks, which have played a main role in Wall Street’s recent record run, rose 0.8%. Investors brushed aside fears from China’s new flu-like virus that has killed nine and infected 440 in the country after President Xi Jinping said curbing the outbreak and saving lives was a top priority. The main indexes retreated from record highs on Tuesday after officials confirmed the first U.S. case of the coronavirus. “While the death toll has risen to nine, it feels like affirmation we’re getting out of China is stemming fears that this is turning into an epidemic,” said Art Hogan, chief market strategist at National Securities in New York. The outbreak, which revived fears of a pandemic similar to the Severe Acute Respiratory Syndrome (SARS) in 2003, roiled travel and airline stocks on Tuesday, as millions of people prepared to travel for the Chinese Lunar New Year. Netflix Inc’s shares gave up gains to trade 3.1% lower after the streaming video pioneer beat estimates for quarterly subscription growth, but warned of a tough first quarter. “Being in the fourth-quarter earnings season is going to be the tell. We’re going to find out if we’ve gotten ahead of ourselves or valuations are justified,” said Hogan. At 10:12 a.m. ET, the Dow Jones Industrial Average rose 0.29% to 29,280.61. The S&P 500 gained 0.36% to 3,332.60 and the Nasdaq Composite was up 0.54% at 9,421.75. Chip stocks benefited from a strong forecast from Dutch firm ASML Holding NV, the latest large chipmaker to indicate a recovery in the sector. The Philadelphia Semiconductor index rose 1.2%. Among the weak spots was Johnson & Johnson, dropping 1.9% after the healthcare","Jan 22, 2020",https://www.reuters.com/article/usa-stocks/us-stocks-sp-500-nasdaq-hit-record-on-ibm-waning-china-virus-fears-idUSL4N29R3WS
15,Boeing Pushes Back 737 Max Return Again - The New York Times,Boeing Pushes Back 737 Max Return Again. Latest Updates. Site Index. Site Information Navigation,"ADVERTISEMENT  The company told airlines it did not expect regulators to approve the plane to fly until June or July, the latest in a string of setbacks. By Natalie Kitroeff The return of Boeing’s 737 Max has been delayed again. On Tuesday, the company said it did not expect regulators to approve the jet to fly again until the middle of the year. American Airlines, United and Southwest had already taken Max flights off their schedules until June, and if this new timeline holds, it would further push back when the plane will be available for commercial flights. The announcement reflects Boeing’s new appreciation for the challenges facing the company in its effort to persuade regulators that the Max is ready to fly. Boeing and the Federal Aviation Administration have continued to find new flaws with the Max that go beyond an automated software system known as MCAS. The software contributed to two accidents, in late 2018 and early 2019, that killed 346 people and led to the worldwide grounding of the Max in March. But the new estimate is conservative and intended in part to give Boeing some leeway with airline customers, who became frustrated over the past 10 months after the company repeatedly missed its own optimistic deadlines for the plane’s return to service, according to three people familiar with the matter. If regulators find no new problems with the plane, they could lift the grounding by the spring, the people said. Once the plane is cleared to fly, it will take airlines weeks to reintegrate them into their commercial schedules. The three United States carriers that fly the Max — American, United and Southwest — had already pushed back Max flights until June. They did not immediately change those schedules in response to Tuesday’s announcement. “Returning the Max safely to service is our No. 1 priority, and we are confident that will happen,” the company said in a statement. “We acknowledge and regret the continued difficulties that the grounding of the 737 Max has presented to our customers, our regulators, our suppliers and the flying public.” Late last year, Boeing discovered a potential problem with wire bundles on the plane, which were placed so close together that an electrical short could cause a catastrophic accident. In assessing the issue, the company recently identified about a dozen places in the Max where wire bundles may need to","Jan 22, 2020",https://www.nytimes.com/2020/01/21/business/boeing-737-max.html
16,"Stock Market Today: January 22, 2020",". Daily Updates. Stock Market Today:. Stock Market Today: January 22, 2020. Stock Market Today:. December 18, 2020. Stock Market","After The Close - The equity market opened higher this morning, but reversed course, and softened quite a bit as the session progressed. Initially, traders seemed to be feeling more confident about the medical situation in China, as health officials have taken action to contain a serious virus that has broken out there. Given the size of China’s economy, Wall Street has concerns that a protracted epidemic could be problematic for global trade. At the close of the day, the Dow Jones Industrial Average was down 10 points; the broader S&P 500 Index clung to a one-point gain, and the NASDAQ managed to advance 13 points. Market breadth was mixed, with advancers just ahead of decliners on the NYSE. The technology, consumer, and utility names managed to make progress, while the industrials and basic materials issues moved lower. Meanwhile, in economic news, the real estate market seems to be in reasonably good shape. In fact, existing home sales increased to annual rate of 5.54 million units during the month of December. In addition, the FHFA Index showed home prices increased 0.2% in January.  Tomorrow, we will get a look at the latest weekly initial jobless claims. The Conference Board’s leading indicators report for the month of December is also set to be released. In corporate news, the fourth-quarter earnings season has finally gotten started. We recently heard from some widely held names. Of note, shares of International Business Machines (IBM – Free IBM Stock Report) moved up today, after the technology giant posted a better-than-anticipated revenue report. Meanwhile, Netflix (NFLX) stock dipped, after the media company provided a softer-than-expected business outlook. Elsewhere, shares of Johnson & Johnson (JNJ – Free J&J Stock Report) closed down, as that company put out a lackluster report.

Technically, stocks have made progress for much of January. However, it remains to be seen if the bulls can keep their buying campaign in place, or if a period of consolidation might be in order.

At the time of this article’s writing, the author did not have positions in any of the companies mentioned. - Before The Bell - Wall Street began the new trading week following the long holiday weekend, which had observed the birthday of Dr. Martin Luther King Jr, with hope by the bulls that we would see an extension of the vigorous January rally in the stock market that had seen the Dow Jones","Jan 22, 2020","https://www.valueline.com/Markets/Daily_Updates/Stock_Market_Today__January_22,_2020.aspx"
17,Sector ETFs & Stocks to Gain/Lose on Coronavirus Outbreak,. . . . S&P 500. Dow 30. Nasdaq. Russell 2000. Crude Oil. Gold. Silver. EUR/USD. 10-Yr Bond. GBP/USD. USD/JPY.,"                                                   Global markets turned wobbly at the outbreak of the deadly SARS-like coronavirus in China. Authorities in China reported on Monday that 139 new cases of coronavirus had been found over the weekend, according to Reuters. The disease has taken 9 lives in China to date. With the Lunar New Year on Jan 25, fears of the spread of the disease have grown as millions of people will be traveling to and from China during this weened. To make matters worse, the United States has already confirmed its first case of coronavirus. Asian stocks were hit hard as travel and commerce would get disrupted owing to the threat. Global markets took the cues and slumped in recent trading. Below we highlight a few ETF areas and stocks that could gain/lose from this outbreak. Losers Airlines No wonder, the event is likely to disrupt global air travel. U.S. Global Jets ETF JETS fell about 3% on Jan 21 with United Airlines Holdings, Inc. UAL shedding about 4.4%. American Airlines Group Inc. AAL and Delta Air Lines, Inc. DAL were off 4.2% and 2.7% on the day, respectively. Chinese airlines stocks like Air China and China Eastern were also hit hard. Hotels Hotel and casino operators Las Vegas Sands Corp LVS and Wynn Resorts Ltd WYNN, both of which have considerable exposure to China, lost 5.4% and 6.1% on Jan 21. China Lodging Group Limited HTHT lost 10.6% on Jan 21. Apart from these China-centric hotel stocks, bid hoteliers like Marriott International, Inc. MAR (down 3.9% on Jan 21), Hyatt Hotels Corporation H (down 2.7%) and Civeo Corporation CVEO) (down 2.3%) also shed gains. VanEck Vectors Gaming ETF BJK, which has 44.9% exposure to the United States and 13.4% focus on China, lost about 3.8% on Jan 21. Invesco Dynamic Leisure And Entertainment ETF PEJ) lost about 2.2% on Jan 21. Materials Per analysts, steel stocks have a sizable exposure to China. So, VanEck Vectors Steel ETF SLX lost 2.7% on Jan 21 with United States Steel Corporation UTX shedding 5.2%. Meanwhile, copper miners bore the brunt too as China is a","Jan 22, 2020",https://finance.yahoo.com/news/sector-etfs-stocks-gain-lose-180006237.html
18,Bloomberg - Are you a robot?,Bloomberg. We've detected unusual activity from your computer network. Why did this happen?. Need Help?,"To continue, please click the box below to let us know you're not a robot. Please make sure your browser supports JavaScript and cookies and that you are not blocking them from loading. For more information you can review our Terms of Service and Cookie Policy. For inquiries related to this message please contact our support team and provide the reference ID below.","Jan 21, 2020",https://www.bloomberg.com/news/articles/2020-01-22/here-s-how-the-airline-industry-is-dealing-with-the-wuhan-virus
