,title,headers,text,date,link
11,3 ASX dividend shares to buy in 2020,. . . . . . . . . 3 ASX dividend shares to buy in 2020. 1. Harvey Norman,"      Ken Hall | February 16, 2020 11:34am | More on: HVN NAB QAN WBC ASX 200 If you’re into ASX dividend shares, you might be wondering where the value is at right now. The S&P/ASX 200 Index (INDEXASX: XJO) is near all-time highs and climbing higher in 2020. In the midst of a busy February, here are 3 ASX dividend shares that I think could be in the buy zone right now.  The Harvey Norman share price is one of those ASX dividend shares that also offers capital growth. Shares in the Aussie retailer have surged 34.41% in the last 12 months to $4.57 at the time of writing. I like Harvey Norman because it is still yielding 7.16% despite the strong recent gains. There are signs of weakness in the Aussie retail sector but so far, Harvey Norman has ridden the storm. NAB shares have been under pressure in recent years alongside its other Big Four peers. However, NAB is also yielding 6.44% right now and could be the pick of the ASX banks. The Aussie bank is among my top ASX dividend shares and could have some further capital upside. In terms of pure yield, Westpac Banking Corp (ASX: WBC) shares offer more (6.97%) but I think the AUSTRAC scandal is worth steering clear of. I think NAB or Macquarie Group Ltd (ASX: MQG) are worth keeping an eye on in 2020. Qantas shares are currently yielding 3.89% at the time of writing and could be in the buy basket. I’ll be waiting for the airline’s results on 20 February to see how the financial position is looking. Qantas has significant hedging activities that could be beneficial in 2020 if oil prices are volatile. Qantas looks like one of the top ASX dividend shares right now and its shares are up 19.11% since early June. If you’re happy with exposure to the airlines, now could be a good time to buy. The Qantas share price has edged lower on coronavirus concerns but the long-term investment fundamentals still look good to me. Motley Fool Australia's Dividend experts recently released a brand-new FREE report revealing 3 dividend stocks with JUICY franked dividends that could keep paying you meaty dividends for years to come. Our team of investors think these 3 dividend stocks should be a 'must consider' for any savvy dividend investor. But","Feb 16, 2020",https://www.fool.com.au/2020/02/16/3-asx-dividend-shares-to-buy-in-2020/
12,"Covid 19 | Latest & Breaking News on Covid 19 | Photos, Videos, Breaking Stories and Articles on Covid 19",". India’s manufacturing PMI shows robust recovery continued in February. Coronavirus outbreak: Check out the death toll, no of persons","                                           India tops Asian manufacturing PMIs The World Health Organization has named the illness COVID-19, referring to its origin late last year and the coronavirus that causes it. Historically, the impact of such diseases has been transitory Earlier instances show that the correction from such emergencies is sharp and short, but this time the virus seems much more contagious and has spread rapidly across the globe Italy has reported more than 400 cases, with the country struggling to contain the spread of the virus in its northern region. Speculative interest is building up in gold  In a statement on Wednesday, the airline said it has made temporary adjustments to selected services to/from Bangkok and Singapore for March. It has also asked senior management to voluntarily take up to a year-long pay cut of 5 percent on their basic salaries and will partially reduce their bonuses The company states that it uses computational mapping to convert facial features into an image onto the surface of N95 masks without distortion. While the current situation of COVID-19 in India is not a cause for alarm, this is another reminder that our public health system needs to be strengthened to face such situations. The COVID-19 outbreak has not only brought to fore the employment uncertainty workers face in the service sector but has also showed China’s incapacity to come up with a formal solution to this. This is a problem that echoes in India as well. Efforts to find a coronavirus vaccine have already started globally An excerpt from a 1981 book written by an American author talks elaborately about a bioweapon developed by the Chinese government called the Wuhan 400 The death toll from COVID-19 outbreak in China has climbed to 1,770 after 105 more people died, mostly in the worst-hit Hubei province, officials said on Monday. The Indian Embassy in a statement added that the ship, Diamond Princess, has been quarantined by Japanese authorities till February 19. The ‘Co’ stands for corona, ‘vi’ for virus, ‘d’ for disease, and the ’19’ stands for the year of its outbreak.  Copyright © e-Eighteen.com Ltd
All rights resderved. Reproduction of news articles,","Feb 17, 2020",https://www.moneycontrol.com/news/tags/covid-19.html/page-184/
13,Macquarie Group Limited | Global Financial Services,2021 global economic and market outlook. . We are a global financial services group operating in 31 markets. 51 years.,"                        of unbroken profitability employees globally assets under management  Perspectives  News  Investors   Careers at Macquarie Shemara Wikramanayake
Managing Director and Chief Executive Officer Disclaimer This information is a general description of the Macquarie Group only. Before acting on any information, you should consider the appropriateness of it having regard to your particular objectives, financial situation and needs and seek advice. No information set out above constitutes advice, an advertisement, an invitation, a confirmation, an offer or a solicitation, to buy or sell any security or other financial, credit or lending product or to engage in any investment activity, or an offer of any banking or financial service. Some products and/or services mentioned on this website may not be suitable for you and may not be available in all jurisdictions. All securities and financial products or instrument transactions involve risks. Past performance of any product described on this site is not a reliable indication of future performance. Follow us © Macquarie Group Limited","Feb 17, 2020",https://www.macquarie.com/
14,Three men stole 600 toilet paper rolls in Hong Kong amid fears of coronavirus shortages - CNN,Three men stole 600 toilet paper rolls in Hong Kong amid fears of coronavirus shortages. . . . . .,"By Jessie Yeung, Eric Cheung and Chermaine Lee, CNN  Updated 0831 GMT (1631 HKT) February 17, 2020 Hong Kong (CNN)Police in Hong Kong have arrested two men and are searching for a third after the group stole about 600 toilet paper rolls, in a robbery likely sparked by coronavirus fears that have gripped the city.                  ","Feb 17, 2020",https://edition.cnn.com/2020/02/17/asia/hong-kong-toilet-roll-robbery-intl-hnk-scli/index.html
15,No timeline to remove I-T exemptions: Nirmala Sitharaman,No timeline to remove I-T exemptions: Nirmala Sitharaman. . ,"  HYDERABAD : Finance Minister Nirmala Sitharaman on Sunday said the idea behind introducing second alternative tax slabs sans exemptions is to take the country towards ""a simplified, exemption-free and reduced rate of tax regime."" However, there was no timeframe set by the government to remove all exemptions, she told reporters here after an interactive session with trade representatives and intellectuals on the Union budget. ""At the moment we only started a second alternative with some exemptions removed or some exemptions included, although the original intention was to remove all exemptions and give a clear simplified reduced rate of income tax,"" the finance minister said. The budget 2020-21 has introduced more tax slabs and offers higher limits provided the taxpayer is ready to forego all the existing exemptions and deductions including home loan interest, other tax savings investments.          ","Feb 16, 2020",https://www.livemint.com/budget/news/no-timeline-to-remove-i-t-exemptions-nirmala-sitharaman-11581862140185.html
