,title,headers,text,date,link
11,Why Shares of Sabre Are Down Today | The Motley Fool,Why Shares of Sabre Are Down Today. The travel software company confirms that the coronavirus is going to materially affect,"   Shares of Sabre (NASDAQ:SABR) fell more than 15% on Wednesday after the travel software company said the coronavirus will have ""a material impact"" on its 2020 financial results, though it is not yet able to tell how big that impact will be. Sabre, a onetime subsidiary of American Airlines Group, still runs the back-end reservation systems for many airlines. With American and other airline stocks falling due to concerns the coronavirus outbreak will eat into travel demand, it is only logical that Sabre would feel the pinch as well. IMAGE SOURCE: GETTY IMAGES. Sabre on Wednesday reported fourth-quarter results in line with expectations but confirmed that the outlook for 2020 is uncertain due to the coronavirus. The company provided initial guidance for 2020 earnings of between $1.10 and $1.30 per share, with the midpoint below analysts' $1.24-per-share consensus, but said it has not yet incorporated the impact of the coronavirus into those results. Airlines in late January canceled flights into China due to the country's virus-related shutdown, and in recent days, as the outbreak has spread to new regions, there has been growing concern that anxiety about the virus could cause a depressed summer travel season. If so, the impact of the coronavirus would last into the second half of the year, bringing down results for airlines and for companies like Sabre that serve them. Even before the coronavirus outbreak, Sabre was having a hard time getting investors interested in its shares, with the stock basically flat over the five-year period leading up to Wednesday's earnings announcement and underperforming the S&P 500 by about 50 percentage points during that period. The company has a plan to spur growth, having acquired Radixx to expand its services to low-cost airlines. It has also announced plans to build a full-service property management system with hotel giant Accor. ""The travel ecosystem is continuing to shift as the needs of our airline, hotel and agency customers change,"" Sean Menke, CEO of Sabre and the former head of Frontier Airlines, said in a statement. ""We must continue to evolve retailing, distribution and fulfillment of travel to help our customers drive revenue growth and increase traveler loyalty."" That's all well and good, but it is going to take time to play out. Given the near-term uncertainty involving the coronavirus, investors on Wednesday aren't interested in waiting around to see what happens.   ","Feb 26, 2020",https://www.fool.com/investing/2020/02/26/why-shares-of-sabre-are-down-today.aspx
12,,,,"Feb 26, 2020",https://www.bizjournals.com/dallas/news/2020/02/26/warren-buffett-southwest-american-airlines.html
13,3 Airline Stocks to Watch Approaching Soft Landings Now | InvestorPlace,"3 Airline Stocks to Watch Approaching Soft Landings Now. China's coronavirus is bringing pain to the transportation sector, but don't"," Source: Shutterstock The mood on Wall Street has soured, and for good reason. Investor sentiment is being tested hard. The coronavirus from China is spreading like wildfire around the globe, creating panic among world leaders. Consequently, countries are closing borders and businesses are shutting down. Microsoft (NASDAQ:MSFT) updated investors about the outbreak’s impact on PC sales yesterday. The airline stocks in particular were hit very hard. Delta Air Lines (NYSE:DAL), for example, is down 20% from recent highs. Most of that drop came in the last few days. It continues to cancel flights to and from impacted areas. It’s not suffering alone, as Southwest Airlines (NYSE:LUV) is also 15% below its January levels. Investors are right to be nervous, but sometimes they overreact. Today we will examine the opportunities in these two stocks. Perhaps they have been punished too harshly and maybe there are levels where they will find footing. In addition, we will also look at the Transportation sector via the iShares Transportation Average ETF (BATS:IYT) as an alternative to betting on single stocks. Before we delve into some details it is important to note that the goal today is not to call a bottom. My point here is to assess the upside potential and quantify the downside risk. Catching falling knives is a dangerous practice, especially when the tickers in question are in the direct line of the virus. Travel and leisure stocks will probably be last to recover, and they started suffering first. Supply chains may have some leeway, but travel will remain challenged until the solution comes. Patience is key and caution is warranted. YOUR FREE GUIDE TO 2021’S BEST EV STOCKS IS HERE  It’s no secret that DAL is a star among airline stocks. But in a year where shares are down 8% while the S&P 500 is up almost 10%, recognizing its star status doesn’t alone justify the bull thesis. It’s the best of a sector, but it’s in a sector that can’t sustain any momentum on Wall Street. Even though they can’t seem to find a bottom, there are signs the end of their suffering could be near. There are two reasons for that — one fundamental and one technical. First, Delta Air Lines stock has a little fat left on it. It sells at a price-earnings ratio of 7.9 and a price-sales ratio of 0.8. Investors are not giving its","Feb 27, 2020",https://investorplace.com/2020/02/3-airline-stocks-to-watch-approaching-soft-landings-now/
14,United Airlines Hit With Two Analyst Downgrades on Coronavirus - TheStreet,. . United Airlines Hit With Two Analyst Downgrades on Coronavirus. McConnell Hopeful for Stimulus Bill Agreement on Saturday. 10,"Shares of United Airlines  (UAL) - Get Report dropped Thursday after analysts downgraded the stock amid fears about the spreading coronavirus. Deutsche Bank analyst Michael Linenberg reduced his rating to hold from buy. “We are lowering our ratings to hold on most of our buy-rated U.S. airline stocks (AAL, ALK, DAL, JBLU, SAVE and UAL), as it is becoming increasingly more likely that the spread of Covid-19 will disrupt travel patterns beyond China,” he wrote in a report. “We are also concerned that the coronavirus crisis will start to negatively impact peak travel periods such as spring break, Easter travel and early summer, which we believe is already starting to manifest itself in lower booking trends,” the analyst added. Corporate travel restrictions also are a problem, Linenberg said. Daniel McKenzie, an analyst at Buckingham Research, downgraded United Airlines to neutral from buy and lowered his share-price target to $61 from $105. SPECIAL REPORT: Download Jim Cramer's 25 Rules for Investing Whitepaper and become a smarter investor. “Earnings uncertainty surrounding the coronavirus is too great for us to quantify, and given the number of potential scenarios, we’re uncomfortable with our full year estimate, but are comfortable there’s downside, hence the reset of our valuation multiple,” he wrote in a report. His forward price-earnings-ratio estimate is 5.5, down from 9.5 previously. “With the Covid-19 spreading, it’s unclear what our 2020 EPS will ultimately look like, but it could look closer to $5-$8/share,” McKenzie said. The coronavirus has so far killed 2,180 people and infected more than 82,500, accorinfg to Johns Hopkins CCSE. At last check, United shares traded at $63.65, down 4.33%. Coronavirus Market Update: Sign up for TheStreet's Coronavirus Market Update newsletter and get the latest market headlines delivered to your inbox daily. Dan is a freelance writer whose work has appeared in The Wall Street Journal, Barron's, Institutional Investor, The Washington Post and other publications.","Feb 27, 2020",https://www.thestreet.com/investing/united-airlines-analysts-downgrade-coronavirus
15,Tel Aviv Stock Exchange tumbles alongside world markets amid growing virus panic | The Times of Israel,Tel Aviv Stock Exchange tumbles alongside world markets amid growing virus panic. TASE sees its biggest daily drop since 2018;," The Tel Aviv Stock Exchange and other world markets plummeted on Thursday amid fears of a coronavirus pandemic. The TA-35 index dropped 4.54 percent and the TA-125 index sank 4.14%, by closing time. The daily decline was the most severe since December 2018. The TA-35 is down 7.1% for the week. Get The Start-Up Israel's Daily Start-Up by email and never miss our top stories
FREE SIGN UP El Al airlines, already struggling for weeks, dropped 7.47% on Thursday. Shares of the airline have dropped over 20% since the start of 2019. The company told the stock exchange that it expects to see a loss of $50-70 million in revenue between January and April. In New York, stocks took a dive Thursday after several days of decline. The Dow Jones Industrial Average is now trading 10% below the record high it hit just two weeks ago. The major indexes were down around 2% by mid morning. US airlines also took a significant hit, with American Airlines falling 5.5%. Japan’s Nikkei 225 index fell 2.13%, and is down 7.23% for the week. Some drug companies have fared better — Teva pharmaceuticals is up 19.4% in the past month on the Tel Aviv exchange, and Gilead Sciences, which said it is experimenting with an antiviral treatment, has climbed 16.6% in the past month in New York. El Al on Thursday said it was suspending flights to Italy and Thailand due to the virus, and that it would delay its planned launch of direct flights to Tokyo until April. The airline extended its halt of flights to Beijing and Hong Kong until May. Israel has banned foreigners who were recently in China, Hong Kong, Macau, Thailand, Singapore, South Korea, Japan and Italy, and ordered Israelis returning from those countries to self-quarantine. The Health Ministry urged Israelis Wednesday to seriously consider refraining from traveling abroad, becoming the first country to issue such a statement. The Health Ministry said Thursday that an Israeli man who returned from Italy for the disease, the first case of an infection in the country outside of a hospital quarantine, raising fears he may have infected others. The coronavirus, which emerged in China late last year, has killed over 2,760 people and infected over 81,000 in 45 countries. The vast majority of infections and deaths have been in mainland China. Does The Times of Israel give you valuable insight into","Feb 27, 2020",https://www.timesofisrael.com/tel-aviv-stock-exchange-tumbles-alongside-world-markets-amid-growing-virus-panic/
16,Seven Days: 28 February 2020 -  Investors' Chronicle,"Seven Days: 28 February 2020. A round up of the biggest business stories of the past week. MOST READ
Today. Terry","Coronavirus knocks markets Airline stocks among worst affected Financial markets around the world have endured a turbulent week amidst ongoing fear about the spread of the coronavirus outbreak, known as Covid-19. This followed a spike in the number of cases in Italy, and reports that Iran’s deputy health minister has tested positive for the virus. Airlines and travel companies were among the stocks worst affected, as we explore in our news pages this week. The oil price was also in decline. In an interview with CNBC, US National Economic Council Director Larry Kudlow indicated that the stock market sell-off could represent a buying opportunity for longer-term investors.   Countrywide and LSL in merger talks Discussions ongoing Countrywide (CWD) and LSL Property Services (LSL) confirmed that they are in talks over an all-share merger at the start of the week. Shares in the former troubled estate agency services group – which had agreed the sale of its commercial business in November – were down 4 per cent in early trading on the release of this news. Discussions between the two parties are ongoing, and – at this stage – the groups said that there can be no certainty that any offer will ultimately be made for Countrywide.   Urban house prices rise Up 3.9 per cent House prices in all cities in England have climbed above their 2007 peak for the first time since the financial crisis, according to the latest Zoopla UK Cities House Price Index. The annual rate at which property values are rising across all UK cities reached a 33-month high of 3.9 per cent in January 2020. Richard Donnell, head of research and insight at Zoopla, said: ""An imbalance between supply and demand is supporting the current rate of house price growth – a trend we expect to remain in place in the first half of 2020”.   GSK and Clover join forces on coronavirus Research partnership China-based clinical-stage biotech company Clover has entered into a research partnership with GlaxoSmithKline (GSK) for its protein-based coronavirus vaccine candidate, ‘COVID-19 S-Trimer’. “We are proud to contribute to cutting-edge research from scientists at Clover Biopharmaceuticals in China as part of our strategy to make our adjuvant technology available to selected partners who have a promising vaccine candidate against the newly emerged coronavirus,” said Thomas Breuer, chief medical officer of GSK Vaccines. Ted Baker updates strategy Cutting roles","Feb 27, 2020",https://www.investorschronicle.co.uk/shares/2020/02/27/seven-days-28-february-2020/
17,Why Coronavirus Is Causing Airline Shares To Plummet In Value - Simple Flying,Why Coronavirus Is Causing Airline Shares To Plummet In Value. Airline stocks take a battering. Constant continuous shock syndrome. Problem," Amid fears that the coronavirus is spreading beyond China, share markets are in retreat this week and airline share prices are no exception. United Airlines opened on the Nasdaq on Monday morning at a touch over USD$78. They closed on Tuesday evening at USD$70.58. IAG, the owner of British Airways and Iberia, opened on the LSE on Monday morning at 623.00p. They closed last night on 551.40p. American Airlines’ share price dropped 8.5% on Monday, closing at USD$25.45, a four-month low. The slide continued on Tuesday, closing at USD$23.12. It was a pattern repeated at stock exchanges around the world on Monday and Tuesday. Some stock exchanges have already opened for Wednesday trading and share prices continue to fall. Airlines, vulnerable as they are to external forces, are always amongst the first companies to feel the effects of wider economic downturns. You may need to keep buying food to eat but the vast majority of us do not need to keep flying. One airline boss said that, even before coronavirus, the wider aviation operating environment was constantly challenging. He said an airline needed to be structured so as to keep flying in the face of continuous challenges. He called it constant continuous shock syndrome, saying an airline needed to be very robust to survive. The Chinese carriers are the most heavily impacted, with more than 200,000 flights to, from and within China already canceled. But any airline operating services to and within Asia is adversely affected. The problem is set to get worse before it gets better. There are reports of coronavirus outbreaks in South Korea and Italy and talk of closing borders to citizens of more countries. There are no indications that the coronavirus outbreak has peaked. The problem for airlines is multi-faceted. As existing flights are canceled and/or suspended, airlines are foregoing revenue from future ticket sales and incurring expenses by issuing refunds on prior ticket sales. Further, there are signs of deep discounting to stimulate short term future travel. Last night, I was to able to buy a ticket from Australia to South East Asia for under USD$100. This is great for me, but the problem for the airline is foregone revenue. Before the coronavirus outbreak and slumping travel demand, that ticket would have sold for around USD$250. As the discounting looks set to spread, it represents rich pickings for bargain hunters and bad news for","Feb 26, 2020",https://simpleflying.com/why-coronavirus-is-causing-airline-shares-to-plummet-in-value/
18,Airlines slump in London as FTSE 100 slammed by coronavirus fears - MarketWatch,MarketWatch Site Logo A link that brings you back to the homepage. .mwA1{fill:#ffffff;} .mwA2{fill:#4db74d;}. London Markets. Airlines slump in London,"    Get the tools you need to succeed in the market, with real-time market data, news, and analysis from MarketWatch — one of the most reputable brands for personal finance, business, and market news. Become a MarketWatch subscriber today.    ","Feb 27, 2020",https://www.marketwatch.com/story/airlines-slump-in-london-as-ftse-100-slammed-by-virus-fears-2020-02-27
