,title,headers,text,date,link
11,Airline stock buybacks versus employee compensation - Business Insider,". DOW
-0.41%. S&P 500
-0.35%. NASDAQ 100
-0.07%. Airline salaries compared to stock buybacks show why so many people are angry at","  Following is a transcript of the video. Narrator: Earlier this month, Airlines for America, a trade group representing the major US airlines, asked the federal government for $50 billion in assistance ""to protect and preserve the 750,000 jobs of hardworking men and women who are directly employed by U.S. airlines."" This set up a heated showdown. There's the industry, which says it's in desperate need of financial help, and then there are elected officials and activists, who say the airlines would not be in this position if they did not spend so much of their money on stock buybacks, which a lot of people see as the companies lining the pockets of shareholders over all else. Buybacks are often used as a way to boost a company's stock price. The repurchases shrink shares outstanding, which increases the value of the remaining units. They're frequently viewed as a signal from management that the stock is attractively priced. So, we're going to take a look at the airlines' own data to help explain why people are so mad about this bailout. Let's start with American Airlines. It's the biggest airline in the US and reported having almost 134,000 employees in 2019. Let's take a moment here to watch the amount American paid in salary, wages, and benefits grow over the last 10 years. Now, it dips a little in 2013, but let's not focus on that. Instead, take a look at the end point here. In 2019, American reported paying all of its employees a grand total of $12.6 billion. Now let's add another line. This is the amount American spent on its share-buyback program, which just means money used to buy back its own stock. It's a move that financially engineers share-price gains, which enriches shareholders. This didn't start happening until 2014, when the company spent just over $1 billion on its stock. Its buyback program shot up for the next couple of years before coming back down and staying around the $1 billion mark. So, we've got a billion here, almost $4 billion here, $4.5 billion here, add this, and this, carry the one, and if you add it all up, American has spent $12.9 billion over the last six years on its own stock. People are mad because $12.6 billion is what it cost to pay the employees' salaries for an entire year, and if you add","Apr 3, 2020",https://www.businessinsider.com/airline-stock-buybacks-versus-employee-compensation-2020-4
12,Access to this page has been denied.,"To continue, please prove you are not a robot"," To ensure this doesn’t happen in the future, please enable Javascript and cookies in your browser.
Is this happening to you frequently? Please report it on our feedback forum. If you have an ad-blocker enabled you may be blocked from proceeding. Please disable your ad-blocker and refresh. Reference ID: 0db8eec0-42a6-11eb-bd97-215157a1adb3","Apr 2, 2020",https://seekingalpha.com/article/4335689-american-airlines-not-dire
13,"In coronavirus pandemic, Warren Buffett sells some Delta, Southwest airlines stock",. . . . S&P 500. Dow 30. Nasdaq. Russell 2000. Crude Oil. Gold. Silver. EUR/USD. 10-Yr Bond. GBP/USD. USD/JPY.,"                                                    Get all the latest news on coronavirus and more delivered daily to your inbox. Sign up here. Billionaire investor Warren Buffett unloaded significant stakes in Delta Air Lines and Southwest Airlines as the industry contends with unprecedented headwinds related to the coronavirus pandemic, according to SEC filings on Friday. Buffett’s holding firm, Berkshire Hathway, sold nearly 13 million shares of Delta, or about 18 percent of its overall stake in the airline. The share sales were worth about $314 million. CORONAVIRUS DRIVES UNDER ARMOUR TO FURLOUGH 6,600 EMPLOYEES The firm also sold about 2.3 million shares of Southwest Airlines, or about 4 percent of its stake. The shares were worth about $74 million. Delta shares plunged more than 11 percent in after-hours trading on Friday. Southwest Airlines shares fell nearly 5 percent after market close. IN CORONAVIRUS PANDEMIC, LOCKHEED MARTIN HIRES NEARLY 1,000 WORKERS The transactions occurred as U.S. airlines experience significant declines in flight traffic due to the pandemic. Authorities in the U.S. and abroad have enacted sweeping travel restrictions and urged citizens to stay home, forcing airlines to make broad cuts to their normal flight capacity. GET FOX BUSINESS ON THE GO BY CLICKING HERE Berkshire Hathaway holds significant stakes in Delta, Southwest, United Airlines and American Airlines. The filings did not say why Buffett’s firm opted to sell stock. Congressional lawmakers passed a $2.2 trillion coronavirus stimulus package last month that included financial relief for U.S. airlines. The measures helped airlines avoid significant layoffs in the short term. However, airline executives have warned in recent days that business is unlikely to improve any time soon. In a letter to employees published Friday, Delta CEO Ed Bastian said the airline is burning more than $60 million per day and expected second-quarter revenue to be down by 90 percent. CLICK HERE TO READ MORE ON FOX BUSINESS Related Articles Best Buy Celebrates 50 Yrs With Saleathon; Will It Turn 60? Canadian Solar Is Facing More Challenges Than It Appears Target Adds Private Bathrooms to Quell Transgender Debate While Gigafactory Berlin construction has been moving at a fast","Apr 3, 2020",https://finance.yahoo.com/news/coronavirus-pandemic-warren-buffett-sells-010125215.html
14,"Berkshire Hathaway sells part of Delta, Southwest airline stakes | Reuters","Berkshire Hathaway sells part of Delta, Southwest airline stakes. . . . . . . . . . . .","Discover Thomson Reuters By Reuters Staff 2 MIN READ (Reuters) - Warren Buffett's Berkshire Hathaway Inc BRKa.N said on Friday it sold about 18% of its stake in Delta Air Lines Inc DAL.N and 4% of its holdings in Southwest Airlines Co LUV.N this week, as the coronavirus pandemic drives the airline industry into perhaps its biggest crisis ever. According to regulatory filings, Berkshire sold nearly 13 million Delta shares for about $314 million and roughly 2.3 million Southwest shares for about $74 million. The sales were conducted on Wednesday and Thursday, the filings show. Berkshire previously owned about 11.1% of Delta stock and 10.4% of Southwest stock, according to Refinitiv data. No reasons for the sales were given. Berkshire did not immediately respond to a request for comment sent to Buffett’s assistant. The Omaha, Nebraska-based conglomerate is among the biggest shareholders of the four largest U.S. carriers - Delta, Southwest, American Airlines Group Inc AAL.O and United Airlines Holdings Inc UAL.O. Buffett has said three of the airline stakes are overseen by him, while one of his portfolio managers, Todd Combs and Ted Weschler, oversees the fourth. Berkshire’s sales were disclosed after major U.S. airlines applied on Friday for payroll grants from the U.S. Treasury to help keep workers employed. The pandemic has punished the industry, as passengers stay home and carriers worldwide slash their schedules and ground planes. Delta projected on Friday that its second-quarter revenue would fall 90%. Reporting by Jonathan Stempel in New York and Rachit Vats in Bengaluru; Editing by Aditya Soni and Leslie Adler Our Standards: The Thomson Reuters Trust Principles. All quotes delayed a minimum of 15 minutes. See here for a complete list of exchanges and delays.                    ","Apr 3, 2020",https://www.reuters.com/article/us-berkshire-stake-airlines-idUSKBN21L393
15,"In coronavirus pandemic, Warren Buffett sells some Delta, Southwest airlines stock | Fox Business","In coronavirus pandemic, Warren Buffett sells some Delta, Southwest airlines stock. Shares of both airlines plunged in after-hours trading Friday.","  Smead Capital Management founder Bill Smead discusses where Berkshire Hathaway CEO Warren Buffett may find opportunities during the coronavirus pandemic and whether Buffett is buying on the market's worst days. Get all the latest news on coronavirus and more delivered daily to your inbox.  Sign up here. Billionaire investor Warren Buffett unloaded significant stakes in Delta Air Lines and Southwest Airlines as the industry contends with unprecedented headwinds related to the coronavirus pandemic, according to SEC filings on Friday. Buffett’s holding firm, Berkshire Hathway, sold nearly 13 million shares of Delta, or about 18 percent of its overall stake in the airline. The share sales were worth about $314 million. CORONAVIRUS DRIVES UNDER ARMOUR TO FURLOUGH 6,600 EMPLOYEES The firm also sold about 2.3 million shares of Southwest Airlines, or about 4 percent of its stake. The shares were worth about $74 million. Delta shares plunged more than 11 percent in after-hours trading on Friday. Southwest Airlines shares fell nearly 5 percent after market close. IN CORONAVIRUS PANDEMIC, LOCKHEED MARTIN HIRES NEARLY 1,000 WORKERS The transactions occurred as U.S. airlines experience significant declines in flight traffic due to the pandemic. Authorities in the U.S. and abroad have enacted sweeping travel restrictions and urged citizens to stay home, forcing airlines to make broad cuts to their normal flight capacity. GET FOX BUSINESS ON THE GO BY CLICKING HERE Berkshire Hathaway holds significant stakes in Delta, Southwest, United Airlines and American Airlines. The filings did not say why Buffett’s firm opted to sell stock. Congressional lawmakers passed a $2.2 trillion coronavirus stimulus package last month that included financial relief for U.S. airlines. The measures helped airlines avoid significant layoffs in the short term. However, airline executives have warned in recent days that business is unlikely to improve any time soon. In a letter to employees published Friday, Delta CEO Ed Bastian said the airline is burning more than $60 million per day and expected second-quarter revenue to be down by 90 percent. CLICK HERE TO READ MORE ON FOX BUSINESS  Quotes displayed in real-time or delayed by at least 15 minutes. Market data provided by Factset. Powered and implemented by FactSet Digital Solutions. Legal Statement. Mutual Fund and ETF data provided by Refinitiv Lipper. This material may not be published, broadcast, rewritten, or redistributed. ©2020 FOX News Network, LLC. All rights reserved. FAQ - Updated Privacy Policy","Apr 3, 2020",https://www.foxbusiness.com/markets/coronavirus-warren-buffett-sells-delta-southwest-airlines
16,Stocks drop as unemployment spikes | TechCrunch,Stocks drop as unemployment spikes. . Sign up for Newsletters. Tags. . Mixtape podcast: Artificial intelligence and disability. Gillmor Gang:,"cameraImage Credits: Jorg Greuel
(opens in a new window) Stocks fell in regular trading Friday, as all major American indices fell in the wake of a broadly negative jobs report. With more than 700,000 jobs lost in the March data, unemployment in the United States rose from 3.5% to 4.4%. The markets have been bracing for widespread job losses due to the continued fallout from COVID-19, the disease caused by coronavirus that has prompted local, county and state officials throughout the U.S. and Europe to issue stay-at-home orders. Those directives have forced bars, restaurants, gyms and other non-essentials businesses to close. While the market had expected a wave of job losses, stocks fell as those figures surpassed expectations. Selloffs were further spurred by this troubling recognition: Friday’s figures only account for unemployment-insurance claims individuals filed in the first two weeks of March, before most of the COVID-related layoffs began. This was unlike Thursday, when negative data led to market gains. Here are the day’s raw results: Shares of SaaS and cloud companies tracked by the Bessemer cloud index fell as well, while cryptocurrencies were roughly flat in the 24-hour period ending with the close of equity trading. There were standouts, however. Shares of Tesla held onto some of their after-hours gains recorded yesterday, closing the day up 5.62% to close at $408.01 as the company continued to ride its positive report that it had delivered more vehicles than expected. Bill.com, a recent SaaS IPO, managed gains as well, closing the day up 2.71%. It was somewhat hard to find exceptions to the selloff; most companies lost ground in the face of worse-than-expected economic data. Every sector saw downward pressure Friday, with the exception of energy and consumer products, which saw a bit of a lift. Oil futures had one of its best days on record, after Russian President Vladimir Putin said global cuts of around 10 million barrels a day are possible. Airlines were also hit Friday after the U.S. Department of Transportation ordered the industry to provide refunds on any flights that companies had canceled. While airline stocks recovered, they all closed in negative territory. United Airlines fell 2.28% to close at $22.88, American Airlines declined 6.8% to $9.38 and Delta Airlines dropped 0.88% to $22.48.   See all newsletters
(opens in a new window) © 2013-2020 Verizon Media.
All rights reserved.
Powered by WordPress VIP
(opens in a new window)
.","Apr 3, 2020",https://techcrunch.com/2020/04/03/stocks-drop-as-unemployment-spikes/
17,Bloomberg - Are you a robot?,Bloomberg. We've detected unusual activity from your computer network. Why did this happen?. Need Help?,"To continue, please click the box below to let us know you're not a robot. Please make sure your browser supports JavaScript and cookies and that you are not blocking them from loading. For more information you can review our Terms of Service and Cookie Policy. For inquiries related to this message please contact our support team and provide the reference ID below.","Apr 3, 2020",https://www.bloomberg.com/news/articles/2020-04-03/u-s-airlines-apply-for-government-aid-with-sales-in-freefall
