,title,headers,text,date,link
13,Coronavirus Is Causing Airfares to Rise  | Barron's,Coronavirus Is Causing Airfares to Rise. ,"  The travel industry has been decimated by Covid-19. People aren’t flying or cruising the high seas. Now cruise operators are offering deals in an attempt to get people to get back on boats. Consumers shouldn’t expect the same from airlines. Airfares, in fact, are rising. It’s counterintuitive, but the cost of a flight was up in April and May. The reason is fairly simple: supply and demand. Far fewer people are flying. That’s the demand side of the equation. But most of the world’s commercial jet fleet is parked, so while demand has cratered, so has the supply of airline seats. Cowen analyst Helane Becker publishes a weekly fare tracker for her clients. The latest couple of reports illustrate the trend. “We track 278 domestic routes across 4 fare products for American, Delta and United, ” wrote Becker in her most recent update, which covers fares through May 11. “Total fares are up 12.29%.” The comparison is with the same week in 2019. In previous updates, which covered fares through April 13 and May 4, Becker found ticket prices rose 13.7% and 10.9% year over year, respectively. She did point out, however, that with demand down more than 90%, fare trends are erratic. Volatility aside, rising fares in April and May may surprise a lot of people. The results are even stranger considering there is another factor that should be reducing prices: The cost of jet fuel is down. Benchmark crude oil prices have fallen 55% year to date, and jet fuel is refined from crude oil. Falling oil should result in lower airline operating costs and, in turn, lower fares. But that isn’t happening right now. Travelers who want a deal can look for a cruise. They appear to be a more affordable option. Carnival (ticker: CCL), for instance, is offering five-day cruises in September 2020 for about $108, plus taxes and fees. That’s pretty cheap. The sale goes through May 20 if investors, or anyone else, feels like they need to get away. Cruise operators are starting to plan for a post-Covid world. People may have to fly to ports, but right now there aren’t a lot of places to go. That’s another reason airfares aren’t cheaper. “There is no incentive to lower them to stimulate demand,” Becker told Barron’s in an email. “As long as major tourist attractions are closed and people are still under","May 16, 2020",https://www.barrons.com/articles/airfare-bargains-coronavirus-cruises-cheap-51589549611
14,Zoom Now Worth More Than 7 Largest Airlines | Financial Synergies Blog,". . The Blog
Weekly insights on the markets and financial planning. . Zoom Now Worth More Than 7 Largest Airlines.","713.623.6600 BLOG GET IN TOUCH CLIENT LOGIN ARE WE RIGHT FOR YOU?   You want to see something crazy? Check out the graphic below (courtesy of the Visual Capitalist). Zoom, the increasingly popular video conferencing company, is now worth more than the world’s largest seven airlines, combined!    Many people had never even heard of Zoom until a few months ago. Now my kids and I are using the technology on a daily basis. My kids have weekly Zoom meetings with their teachers and classmates to go over school lesson plans, and Financial Synergies has adopted it as our preferred virtual meeting application for team and client meetings. Hardly a day goes by without me using Zoom at least once. Many people have transitioned to working and socializing from home. If these trends become the new normal, certain technology companies will be in for a big time payoff. Zoom’s market capitalization has skyrocketed to $48.8 billion, despite posting revenues of only $623 million over the past year. Meanwhile, airline stocks have cratered amid the global COVID-19 pandemic.  When regular air travel will return remains a major question mark. Hopefully sooner rather than later. But it’s clear that Zoom, and similar video conferencing technologies, have taken on a much more important role in our daily lives. And that trend may be permanent. Mike develops investment portfolio allocations, handles trading and rebalancing, and conducts research and analysis as a Portfolio Manager and Financial Advisor for the firm. As a perpetual student of investing and the markets, Mike considers himself obsessed with the subject. Mike has earned the CERTIFIED FINANCIAL PLANNER™ (CFP®) and Certified Fund Specialist® designations. He is also an active member of the Houston chapter of the Financial Planning Association (FPA). Read Mike's Profile Here • Read More Articles by Mike Find out if we’re a good match for your needs. We offer a free, no-obligation consultation to help us get to know each other. We can meet by phone, in-person, or online. FINANCIAL SYNERGIES WEALTH ADVISORS
4400 POST OAK PKWY #200
HOUSTON, TX 77027 Financial Synergies Wealth Advisors is a fee-only Financial Advisor in Houston, TX. We specialize in wealth management services, including comprehensive financial planning and investment management. For more than thirty years we’ve been serving the financial needs of individuals, families, and businesses. Form ADV | Form CRS | Privacy Policy | Disclosure
© 2020 Financial Synergies","May 17, 2020",https://www.finsyn.com/zoom-now-worth-more-than-7-largest-airlines/
15,SIA’s Rights Issue and MCB Explained – Is Singapore Airlines a good investment? | Financial Horse,SIA’s Rights Issue and MCB Explained – Is Singapore Airlines a good investment?. 1) Breaking down the Rights Issue and,"Quite a few readers have asked that I do a piece on SIA. And it’s a really interesting topic, so I was happy to oblige. A reader also helpfully sent across the following questions, which we’ll use as the framework for discussion today: 1) Some interpretation about the complex structure Rights + MCB 2) The valuation of SIA after the rights/MCB? 3) Your recommendations to FH followers on SIA – whether we should subscribe to entitlement or even excess rights? FYI we’ll share commentary on the 2020 crisis every weekend going forward, so for those of you who haven’t signed up for our mailing list, please do – its absolutely free. It’s a weekly newsletter that goes out at noon every Sunday, and rounds up the week’s posts so you never miss anything. Sign up below (you get a free guide when you sign up): Join our weekly newsletter now!  All of the relevant documents are available here: https://www.singaporeair.com/en_UK/sg/about-us/information-for-investors/rights-issue/. Very simply, SIA’s “bailout” is split into 3 parts: Parts 1 and 2 are happening right now, whereas Part 3 may happen later depend on how much cash SIA needs down the road. Part 1 – Rights issue of Rights Shares (raising $5.3 billion) Plain vanilla rights issue. For every 2 shares in SIA you own, you get3 rights at $3.00 each. You can either choose to (1) exercise the rights to get a share in SIA – in which case you need to pay $3.00 per right, or you can (2) sell the rights on the open market – in which case you take the price of the rights on the open market, which is about $3.8 as of today. This will raise a total of $5.3 billion for SIA Part 2 – Rights Issue of Rights Mandatory Convertible Bonds (MCB) (raising $3.5 billion) The MCBs are more unique. I don’t think I’ve seen these ever being offered to retail investors, at least not in this debt cycle. The MCBs are pretty technical, so we’ll skip all the mumbo jumbo and go right into what it means. Imagine that you own $1000 of MCBs. These are zero coupon, so you’ll not get paid any interest (or coupon) each year. But these MCBs can be redeemed by SIA any time within 10 years. And on redemption date, they will pay you $1000 (being the principal) + an extra amount equivalent","May 16, 2020",https://financialhorse.com/sias-rights-issue-explained-is-singapore-airlines-a-good-investment/
16,"Kevin O'Leary talks stock market, ETFs as economic worries mount",Here’s what’s driving stocks higher despite mounting economic worries: Kevin O’Leary. MORE IN ETF EDGE. News Tips. CNBC Newsletters,"Unprecedented demand for stocks. That’s one major piece to the puzzle that is the current relationship between the U.S. stock market and the underlying economy, O’Shares ETFs Chairman and “Shark Tank” investor Kevin O’Leary told CNBC’s “ETF Edge” this week. “Institutional demand for equities is unprecedented given there’s very few choices,” O’Leary said in a Monday interview. “Your fixed-income option of government bonds in the U.S. used to be something you’d ... consider. That’s no longer an option.” With U.S. interest rates near historic lows, investors have been forced to seek income elsewhere, O’Leary said, adding that as a result, large, relatively stable companies with dividend yields of 2.5-3.5% are becoming increasingly good bets. “That’s a very attractive place to park money for the next 24 months, and you’re seeing a tremendous demand for it across the board,” he said. “It’s not the retail investor that’s driving this market. It’s institutional. I speak to them every day. And they’re saying, ‘What other choice do I have if my bogey over the next 12 months is 6%?’ There is no other choice.” “Bogey” is financial jargon for the performance of a given benchmark, such as an equity index. O’Leary added that he wouldn’t be surprised to see a coronavirus treatment or vaccine in as little as 18-24 months given recent advances in medical science. Matthew Bartolini, head of SPDR Americas Research at State Street Global Advisors, said the recent market action suggests that investors are becoming “more selective.” “You saw $15 billion of inflows into sector ETFs in April, with basically health care and tech, so XLV [and] XLK, ... having the most flows on record in a given month because investors were indiscriminately picking out areas of the market that would perform best during a period of sluggish earnings growth [and] economic growth where those firms’ products and services are likely to be sought after,” Bartolini said in the same “ETF Edge” interview. The XLV and XLK are SPDR’s S&P 500 sector ETFs tracking health care and technology stocks, respectively. The XLV is down about 2% year to date and the XLK is up just over 1%. The S&P has declined almost 12% in that time. Recent inflows into beleaguered funds such as the U.S. Global Jets ETF (JETS) and the Energy Select Sector SPDR Fund (XLE) could also signal a spike in investor appetite for equities, Bartolini said. “In","May 16, 2020",https://www.cnbc.com/2020/05/16/kevin-oleary-talks-stock-market-etfs-as-economic-worries-mount.html
17,Stock market today: Dow surges more than 900 points in best day since early April amid hope for coronavirus vaccine,Dow surges more than 900 points in best day since early April amid hope for coronavirus vaccine. News Tips. CNBC,"Wall Street logged its best day in over a month on Monday as news from a Moderna trial stoked optimism about a potential coronavirus vaccine.  The Dow Jones Industrial Average closed 911.95 points higher, or 3.9%, at 24,597.37. The S&P 500 gained 3.2% to close at 2,953.91 while the Nasdaq Composite advanced 2.4% to 9,234.83. The Dow and S&P 500 both had their biggest one-day gains since April 6 while the Nasdaq posted its best rally since April 29. The S&P 500 also closed at its highest level since March 6. Moderna shares rallied 20% after the company reported “positive” phase one results for a potential coronavirus vaccine. The company said that after two doses all 45 trial participants had developed coronavirus antibodies.   “This information coming out of Moderna takes a little bit of the unknown out of the market,” said Christian Fromhertz, CEO of The Tribeca Trade Group. “So there’s a knee-jerk reaction that’s going on with all those names that have been under pressure.” Fromhertz referred to those stocks as “have-nots.” “I think that’s just how it’s going to work,” said Fromhertz. “The closer they get to reopening the country, the more this is going to be beneficial for the ‘have-nots’ and there’s going to be more profit taking in some of the ‘haves.’” Disney closed 7.15% higher while MGM Resorts rallied 10.5%. Cruise operator Carnival gained 15.2%. Delta and United Airlines both rose more than 13%. Netflix — a stock that has benefited from people staying at home — closed 0.3% lower.  Bank stocks rose broadly. Wells Fargo jumped more than 8% while Bank of America and Citigroup both closed over 6% higher. JPMorgan Chase advanced 5.3%. Comments from the Federal Reserve chief also added to the bullish sentiment.  Federal Reserve Chairman Jerome Powell said to CBS’ “60 Minutes” that “there’s a lot more we can do” to help the economy. “We’ve done what we can as we go. But I will say that we’re not out of ammunition by a long shot. No, there’s really no limit to what we can do with these lending programs that we have.” The central bank leader also said he’s “highly confident” the U.S. economy will claw its way back from the current pullback, but warned that it may not fully recover until a Covid-19 vaccine is complete. The Nasdaq Composite and S&P 500 fell","May 17, 2020",https://www.cnbc.com/2020/05/17/stock-futures-up-after-powell-says-economy-could-recover-some-this-year.html
