,title,headers,text,date,link
13,Why Points and Miles Are a Bad Long-Term Investment,Why Points and Miles Are a Bad Long-Term Investment. Recent Devaluations. A Double Emirates Devaluation. Singapore Suites Get More Exclusive.,"This post contains references to products from one or more of our advertisers. We may receive compensation when you click on links to those products. Terms apply to the offers listed on this page. For an explanation of our Advertising Policy, visit this page. It can be easy to slip into the mindset of thinking of your points and miles as simply being another type of money. The similarities are overwhelming — we get some of our favorite points from the same banks where we deposit our paychecks, and we use language like “currency” to describe different kinds of points and miles. However, there’s one very important distinction that needs to be near the front of your mind: Unlike most true currencies, which have the potential for appreciation if invested well, your points and miles are guaranteed to lose value in the long run, and there’s nothing you can do to stop it. Award travel isn’t a contest; there’s no prize for having the most points. Instead, it’s a game that’s best played as much or as little as needed to satisfy your own personal travel needs. In this post, I’ll explain why routinely carrying large balances of points and miles — with no plan to use them — is a bad investment strategy so you can avoid setting yourself up for disappointment, heartache and a possible loss in net (loyalty) worth. In the last few years, we’ve seen a number of painful devaluations of some of our favorite points programs. This has even hit transferable point programs. The general mantra is that transferable points like Chase Ultimate Rewards are slightly more insulated from devaluations than an individual frequent flyer program is. Even if one of Chase’s partners is devalued, plenty of other options will remain. However, Chase dropped Korean Air as a transfer partner last year. At only 80,000 SKYPASS miles each way, Korean is one of the cheapest ways to book first class awards between the US and Asia, and availability on the carrier’s A380s and 747-8s is often excellent. Removing this easy pathway to luxurious, first-class flights was a big hit to the Ultimate Rewards suite of transfer partners. Then earlier this year, United MileagePlus — one of Chase’s strongest transfer partners — announced a switch to dynamic award pricing for its flights beginning on November 15. This devaluation had two worrisome effects: Prices skyrocketed on a","Jun 1, 2019",https://thepointsguy.com/guide/points-and-miles-bad-investment/
14,Does Singapore Airlines Limited's (SGX:C6L) Debt Level Pose A Problem?,. . . . S&P 500. Dow 30. Nasdaq. Russell 2000. Crude Oil. Gold. Silver. EUR/USD. 10-Yr Bond. GBP/USD. USD/JPY.,"                                                   Want to participate in a short research study? Help shape the future of investing tools and you could win a $250 gift card! Small-caps and large-caps are wildly popular among investors, however, mid-cap stocks, such as Singapore Airlines Limited (SGX:C6L), with a market capitalization of S$11b, rarely draw their attention from the investing community. However, generally ignored mid-caps have historically delivered better risk adjusted returns than both of those groups. Today we will look at C6L’s financial liquidity and debt levels, which are strong indicators for whether the company can weather economic downturns or fund strategic acquisitions for future growth. Remember this is a very top-level look that focuses exclusively on financial health, so I recommend a deeper analysis into C6L here. Check out our latest analysis for Singapore Airlines Over the past year, C6L has ramped up its debt from S$3.1b to S$6.7b , which accounts for long term debt. With this rise in debt, the current cash and short-term investment levels stands at S$3.2b , ready to be used for running the business. On top of this, C6L has produced cash from operations of S$2.8b over the same time period, leading to an operating cash to total debt ratio of 42%, indicating that C6L’s debt is appropriately covered by operating cash. At the current liabilities level of S$7.4b, it appears that the company arguably has a rather low level of current assets relative its obligations, with the current ratio last standing at 0.75x. The current ratio is calculated by dividing current assets by current liabilities. With debt reaching 49% of equity, C6L may be thought of as relatively highly levered. This is not uncommon for a mid-cap company given that debt tends to be lower-cost and at times, more accessible. We can test if C6L’s debt levels are sustainable by measuring interest payments against earnings of a company. Ideally, earnings before interest and tax (EBIT) should cover net interest by at least three times. For C6L, the ratio of 15.01x suggests that interest is comfortably covered, which means that debtors may be willing to loan the company","Jun 2, 2019",https://finance.yahoo.com/news/does-singapore-airlines-limiteds-sgx-234742163.html
15,"You can have your plate and eat it too, says Polish inventor",. . . . S&P 500. Dow 30. Nasdaq. Russell 2000. Crude Oil. Gold. Silver. EUR/USD. 10-Yr Bond. GBP/USD. USD/JPY.,"                                                   Polish inventor and entrepreneur Jerzy Wysocki catches a brown plate -- still warm -- as it drops out of a machine and he begins to eat the crunchy, fibrous tableware. ""A pork chop will always be more delicious on this wheat bran plate than on plastic,"" says Wysocki with a big grin at the Biotrem factory in Zambrow in northeast Poland. Taking a bite, the plate does not have much of a flavour. It calls to mind dry cereal flakes or maybe what you would imagine cardboard to taste like. But Wysocki says what matters is the tableware is biodegradable. The sexagenarian invented the plate some 15 years ago, and today Biotrem makes around 15 million of them a year. That figure could soon skyrocket thanks to a decision by the European Union to ban plastic plates and cutlery starting in 2021. A son and grandson of millers, Wysocki got the idea for the tableware when he was looking to use up the leftovers of flour production, which take up a lot of space. But he says he is also driven by the desire to help a good cause, ""because the amount of rubbish that pollutes oceans is huge and frightening."" ""To make the plates, we only use wheat bran, which we compress at a precise pressure point and temperature, using a machine made specifically for that purpose,"" he explains. - Eco-conscious clients - Biotrem CEO Malgorzata Then acknowledges, of course, that at 15 euro cents (17 US cents) a pop or 20 percent more for exports, wheat bran plates are more expensive than their plastic counterparts. But ""the current price of plastic doesn't factor in the environmental cost, that of recycling and marine pollution,"" she adds. At first, the company targeted clients who were environmentally inclined as well as restaurants and hotels that wanted to offer something original. ""Now, with the measures taken by the EU, even clients who are uninformed about the environment are forced to take an interest in biodegradable products,"" Then said.             ","Jun 2, 2019",https://finance.yahoo.com/news/plate-eat-too-says-polish-inventor-195442503.html
16,SpiceJet chief Ajay Singh elected to IATA board - The Financial Express,SpiceJet chief Ajay Singh elected to IATA board. Low cost carrier SpiceJet's Chairman and Managing Director Ajay Singh was Sunday,"Low cost carrier SpiceJet’s Chairman and Managing Director Ajay Singh was Sunday elected to the board of the International Air Transport Association (IATA), less than three months after the airline joined the global grouping. Founder and former chairman of the now grounded Jet Airways Naresh Goyal, who was associated with the IATA for a long time, was a member on the previous board. The new board of the global airlines’ grouping would be chaired by Lufthansa Group Chief Executive Officer Carsten Spohr, who took charge after the conclusion of the IATA annual general meeting here Sunday. Spohr will be the Chairman of the IATA Board of Governors (BoG) for a one-year term. In March, SpiceJet became the first Indian low cost carrier to take membership of the IATA, a grouping of around 290 airlines. Other board members include Air Canada President and CEO Calin Rovinescu, Qantas CEO Alan Joyce and Qatar Airways CEO Akbar Al Baker. Jet Airways, which served the skies for more than 25 years, was forced to temporarily suspend operations in the wake of cash crunch.  Subscribe to Financial Express' weekly SME newsletter for latest and all-round coverage from the world of the biggest business in India - the Micro, Small and Medium Business. Get live Stock Prices from BSE, NSE, US Market and latest NAV, portfolio of Mutual Funds, calculate your tax by Income Tax Calculator, know market’s Top Gainers, Top Losers & Best Equity Funds. Like us on Facebook and follow us on Twitter. Financial Express is now on Telegram. Click here to join our channel and stay updated with the latest Biz news and updates.  ","Jun 2, 2019",https://www.financialexpress.com/industry/spicejet-chief-ajay-singh-elected-to-iata-board/1595650/
17,"With Jet Airways grounded, opportunities narrowing in Indian market: Star Alliance - The Hindu BusinessLine",". Logistics. . The Jet Airways crisis. With Jet Airways grounded, opportunities narrowing in Indian market: Star Alliance. Big market."," MORE Jeffrey Goh, CEO Star Alliance   -  PTI  India is a big aviation market and Air India provides the important domestic network but opportunities in the market are narrowing with Jet Airways being non-operational, Star Alliance CEO Jeffrey Goh said on Sunday. The Star Alliance is a grouping of 28 airlines, including Air India, which became a member in July 2014.
SUBSCRIBER EXCLUSIVE
Technical-Analysis
Daily Rupee call: INR likely to trade with bullish bias
Mobiles-Tablets
HMD Global launches Nokia 5.4   Emphasising that Air India is an important representation for the alliance in the Indian sub-continent, Goh said the airline provides very important domestic network for its members to connect into. “Indian market is a big market and is a very fast growing market... clearly things are changing very fast in the Indian market in connection with what has happened with Jet Airways. I think certainly to that degree possible, it will help (that)... Air India will have higher capacity and better yields because there is less capacity in the market,” he said. Full service carrier Jet Airways, which had a significant number of international flights, temporarily suspended operations in April after running out of cash. To a query on whether there could be a second Indian carrier such as low-cost carrier IndiGo as a Star Alliance member, Goh said the grouping is positioned for having a full member as well as a connecting partner model. “We also have the ability to integrate less traditional airlines whether they are hybrid, regional or low-cost airlines. We are positioned to address both the situations. We are not closed for business, whether an airline in India is interested in full membership or connecting partner model. It is more a question of value proposition that you can bring to the network,” he said. Talking on the sidelines of an IATA (International Air Transport Association) event here, he stressed that an airline should prove its business case if it has to be a member or connecting partner. IndiGo is India’s largest domestic airline with a market share of nearly 50 per cent. Low-cost carrier SpiceJet’s Chairman and Managing Director Ajay Singh was elected to the board of the International Air Transport Association (IATA), less than three months after the airline joined the global grouping. Founder and former Chairman of the now grounded Jet Airways Naresh Goyal, who was associated with the IATA for a","Jun 2, 2019",https://www.thehindubusinessline.com/economy/logistics/with-jet-airways-grounded-opportunities-narrowing-in-indian-market-star-alliance/article27406770.ece
18,"Exclusive: U.S. set to grant tentative approval to American, Qantas venture - sources | Reuters","Exclusive: U.S. set to grant tentative approval to American, Qantas venture - sources. . . . . . . .","Discover Thomson Reuters More By David Shepardson 4 MIN READ WASHINGTON (Reuters) - The U.S. Transportation Department is expected to provide tentative approval to a bid by American Airlines Group Inc and Qantas Airways Ltd to operate a joint venture, two people briefed on the matter said on Sunday. The department is expected to issue an order tentatively approving the joint business agreement and tentatively granting antitrust immunity, according to the sources, who spoke on condition of anonymity. The order, which is expected as early as Monday and would be subject to public comment, is likely to include conditions to protect competition and allow for government oversight of the venture, the sources added. A department spokesman declined to comment on the matter. The application by American and Qantas for a joint venture covering the United States, Australia and New Zealand was tentatively rejected in November 2016 by former President Barack Obama’s administration amid opposition from rival carriers Hawaiian Airlines Inc and JetBlue Airways Corp. Regulators in Australia and New Zealand approved the first application for the joint venture before it was rejected by the U.S. Transportation Department. American Airlines spokeswoman Shannon Gilson said on Sunday the airline feels “we have made a compelling case about the benefits of the joint business for customers, and there was no opposition raised to our proposal. We’re hopeful the Qantas joint business will be approved.” American and Qantas in February 2018 made a second attempt to gain U.S. regulatory permission under President Donald Trump’s administration for a venture that would let them coordinate prices and schedules, threatening to cancel services if it was rejected and arguing it could “unlock” up to $310 million annually in consumer benefits. The revised application made significant changes including removing a provision that would have barred either carrier from codesharing with other carriers. Codesharing is a arrangement between airlines in which two or more carriers publish and advertise a single flight under their own airline number. The airlines argued in their 2018 application that the venture would lead to a reduction in fares and higher capacity as a “more viable third competitor” and require other carriers to respond with improvements to quality, schedules and price. Qantas said last year the joint venture would allow the two airlines to “significantly improve service” and “stimulate demand”. The airlines said the agreement could generate up to 180,000 new trips between the United","Jun 2, 2019",https://www.reuters.com/article/us-usa-airlines-american-qantas-exclusiv-idUSKCN1T4041
19,Technology Archives - Towards Better Questions,GOOD BUTTONS TO CLICK:. Category: Technology. Why The AV Revolution Will Give Southwest Airlines No LUV. The Five Laws of,"Towards Better Questions Mostly tech, sometimes random, always interesting. Question: Why won’t you want to own regional airline stocks in the future?  Better Question: Why would you ever fly from Chicago to New York again?  If I were the CEO of Southwest I’d be terrified of the dawn of self-driving cars.  The average Southwest flight is 757 miles and takes roughly 2 hours.   Aviation contributes 5% of global emissions, making a growing share of consumers unhappy about flying.  I predict that as self-driving vehicles take over, most people will opt to drive to their destination while they sleep.    Assume an overnight AV trip takes 12 hours, including an hour to recharge and take occasional breaks.  The current record for a Tesla is 670 miles on a single charge, which can be expected to increase as battery efficiency improves, making driving 11 hours feasible.  An AV going 70 mph (the current interstate speed limit) you could easily travel 770 miles overnight. With no need for controls, and the engine replaced by small electric motors, chairs will be able to recline into lie-flat beds.  Imagine relaxing in business class…in the backseat of your own car.  In the future, should you wish to travel from Chicago to New York you’ll have a choice.  Option A: Drive to the airport, check in, wait in security lines with hundreds of other people, experience a delay, eat unhealthy food, experience another delay, all while contemplating why bottled water costs 3x the normal price, and then buying it anyway.   OR… Option B: Get in your AV, stretch out, relax, read, work and then lie flat to sleep, only waking up when your car announces that you’ve arrived at your destination.  Hmm. I’m pretty sure I’ll grab my book, reusable water bottle, laptop and pillow, and head for my AV.  How far could you travel in your sleep?  Consider the following:   Once AV’s are a reality, a traveler starting in San Francisco could go anywhere in the green circle. Start in New York and reach any spot in blue. Begin in Austin and travel to any place in purple radius.   AV travel will make the most of your valuable time.  Have a full, productive day, get a great workout, plan to eat at your","Jun 2, 2019",https://betterquestions.blog/category/technology/
