,title,headers,text,date,link
13,Bloomberg - Are you a robot?,Bloomberg. We've detected unusual activity from your computer network. Why did this happen?. Need Help?,"To continue, please click the box below to let us know you're not a robot. Please make sure your browser supports JavaScript and cookies and that you are not blocking them from loading. For more information you can review our Terms of Service and Cookie Policy. For inquiries related to this message please contact our support team and provide the reference ID below.","Jun 21, 2019",https://www.bloomberg.com/news/articles/2019-06-21/airlines-avoid-strait-of-hormuz-as-iran-u-s-tensions-escalate
14,Rep. Angie Craig Introduces HUMBLE Act to Clean Up Washington | Representative Angie Craig,"REP. ANGIE CRAIG INTRODUCES HUMBLE ACT TO CLEAN UP WASHINGTON. MEDIA. . Washington, DC Office. Burnsville Office","Today, U.S. Rep. Angie Craig introduced the Halt Unchecked Member Benefits with Lobbying Elimination or HUMBLE Act, which would permanently ban Members of Congress from serving as lobbyists and require them to sell individual stocks upon being sworn in. The HUMBLE Act also restricts unnecessary perks for Members, including a ban on taxpayer funded first-class airline accommodations.

For too long, Members of Congress have used their positions of power to advocate for special interests and gain personal profits. This bill would ensure that Members of Congress come to Washington to serve and leave just the same.

The HUMBLE Act: “Minnesotans need Congress to be focused on addressing the issues they face in their own lives - including lowering the price of prescription drugs and health care, rethinking career skills and technical education and investing in our roads and bridges. But unfortunately, conflicts of interest and the influence of special interests have gotten in the way of this critical work,” said Rep. Craig. “A lifetime ban on lobbying will ensure that Congress is no longer a revolving door of influence, and banning individual stock ownership will cut down on conflicts of interest and show that Congress has its priorities straight so that we can advocate for policies that will improve lives and expand economic opportunity for every Minnesotan.”

In addition to introducing the HUMBLE Act, Rep. Craig also stood up to House Democratic leadership recently and introduced an amendment to stop an increase in pay for Members of Congress. Rep. Craig has also championed H.R.1, the For the People Act, a comprehensive government reform bill to increase transparency in campaign finance and make it easier to vote. The House adopted Craig’s provision to ban Members of Congress from serving on for-profit corporate boards, and she continues to fight to make government accountable to Minnesotans, not special interests. (202) 225-2271 (651) 846-2120","Jun 21, 2019",https://craig.house.gov/media/press-releases/rep-angie-craig-introduces-humble-act-clean-washington
15,Jain Irrigation: Fitch downgrades Jain Irrigation on concerns over debt levels - The Economic Times,. . . . . . . . . . . Fitch downgrades Jain Irrigation on concerns over debt levels.,    Read Stock Insights by ET for a quick analysis    Download The Economic Times News App to get Daily Market Updates & Live Business News. Why follow tips? Choose your winners rationally in 3 simple steps! All Mutual Funds Top Tax Saver Funds Better Than Fixed Deposits Low Cost High Return Funds Best Hybrid Funds Best Large Cap Funds SIP’s starting Rs. 500 Top Performing Mid Caps Promising Multi Cap Funds Top Rated Funds Trending Now Popular Categories Hot On Web In Case You Missed It ET Verticals More From Our Network Other Useful Links Services         ,"Jun 22, 2019",https://economictimes.indiatimes.com/markets/stocks/news/fitch-downgrades-jain-irrigation-on-concerns-over-debt-levels/articleshow/69901089.cms
