,title,headers,text,date,link
12,Jim Cramer: $25 Billion Can't Save Airlines Without Vaccine,Jim Cramer: $25 Billion Can't Save Airlines Without Vaccine. Watch More on the Coronavirus Pandemic From TheStreet.com:. STOCK PICKS. Apple,"Katherine Ross  Airline stocks--including American Airlines, Delta and United--got a boost after a Reuters report that suggested lawmakers are looking to offer billions more in payroll assistance support to the beaten-down sector. Reuters reported that 16 Republican Senators have backed a plan that would extend the $25 billion of payroll assistance already in place beyond the current September 30 deadline. This came after Reuters saw a letter signed by, among others, Colorado's Corey Gardner and Florida's Marco Rubio. Last week, the International Air Transport Association, an industry lobby group, warned it would take until 2024 for global airline passenger traffic to return to pre-pandemic levels, while June data showed the lowest 'load factor' data in industry history.  President Donald Trump has said that he's in favor to give airlines $25 billion more.  However, Jim Cramer said that this aid will not be enough to stop the mass layoffs and furloughs that the airline industry is facing in October. Cramer said along with many industries, the future of the airlines is ""contingent"" on a coronavirus vaccine.  More From Cramer Thursday: Jim Cramer Calls Honeywell 'Single Best Stock In This Environment' Following a CNBC interview with Nancy Pelosi, Cramer said that Congress should consider simply stating it will support airlines until there is a vaccine, instead of offering another piecemeal solution.  You can follow Katherine Ross on Twitter at @byKatherineRoss. Read more from Katherine Ross here. Jim Cramer's going live to talk all things Apple on July 30 at 10:30 A.M. Here's how to watch. Katherine Ross   by DanKuhn14 The Action Alerts PLUS club call with Jim Cramer was live Thursday, May 14. Cramer will be sharing what trades he is making in May for free. Recap the whole call. StreetLightning Staff   Emmanuella Nwokenkwo & Javier Frausto   by KareemWinters Jim Cramer has some thoughts about Apple as the stock confronts more than one headwind ahead of earnings. Katherine Ross   by DanKuhn14  Jacques Potts   by kperkins2  Kareem Winters   by Jones1942 Jim Cramer weighs in on Amazon's reported interest in AMC. Katherine Ross   by Aol_xp  Kareem Winters   by jeanjoe  Jeeho Yun   by drifter4jc Jim Cramer breaks down how to approach Starbucks as the coffee giant prepares to reopen a majority of its store this week. DanKuhn14 ","Aug 6, 2020",https://www.thestreet.com/streetlightning/stock-picks/jim-cramer-airlines-relief-package-not-enough
13,"Cramer Weighs In On Lumentum, American Airlines And More",. . . S&P 500. Dow 30. Nasdaq. Russell 2000. Crude Oil. Gold. Silver. EUR/USD. 10-Yr Bond. GBP/USD. USD/JPY. BTC-USD.,"                                                   On CNBC's ""Mad Money Lightning Round,"" Jim Cramer said that Sarepta Therapeutics Inc (NASDAQ: SRPT) is good and he would own it, but he prefers Vertex Pharmaceuticals Incorporated (NASDAQ: VRTX). Cramer would be careful with Lumentum Holdings Inc (NASDAQ: LITE) because this group has always hurt him when it has gotten this hot. Royalty Pharma plc (NASDAQ: RPRX) is a good opportunity, said Cramer. He is a buyer of the stock. Cramer sees more upside potential for American Airlines Group Inc (NASDAQ: AAL). In the long term, he likes Southwest Airlines Co (NYSE: LUV) better. TJX Companies Inc (NYSE: TJX) is a very large position for Cramer's charitable trust and he thinks that it is a buy. Instead of Southern Co (NYSE: SO), Cramer would rather buy Sempra Energy (NYSE: SRE). See more from Benzinga 'Halftime Report' Traders Comment On Buffett's Purchase Of Bank Of America Brian Stutland's Gold Trade Joe Terranova Shares His Thoughts On Monster Beverage And Palo Alto © 2020 Benzinga.com. Benzinga does not provide investment advice. All rights reserved. Every week, Benzinga conducts a sentiment survey to find out what traders are most excited about, interested in or thinking about as they manage and build their personal portfolios.We surveyed a group of over 300 Benzinga investors on whether shares of AT&T Inc. (NYSE: T) or Verizon Communications Inc. (NYSE: VZ) stock would grow the most by 2022.AT&T Vs. Verizon Stock In 2020 wireless communication remains AT&T's largest business, contributing nearly 40% of revenue. As the second-largest U.S. wireless carrier, AT&T connects more than 100 million devices, including 63 million regular customers and 16 million prepaid customers.The consumer and entertainment segment, the company's second-largest revenue stream, includes the consumer fixed-line and DirecTV satellite television businesses, serving 20 million television and 14 million internet access customers.Meanwhile, Verizon is primarily a wireless business (70% of revenue and nearly all operating income). The company serves about 89 million regular and 4 million prepaid customers. Verizon connects another 24 million data devices, like tablets, via its nationwide network, making it the largest U.S. wireless carrier.As AT&T and Verizon are the","Aug 6, 2020",https://finance.yahoo.com/news/cramer-weighs-lumentum-american-airlines-151338389.html
14,Curve Flattening Lifts Transportation Stocks,Curve Flattening Lifts Transportation Stocks. . KEY TAKEAWAYS. . IYT Long-Term Chart (2003 – 2020). . IYT Short-Term Chart (2018,"The Dow Jones Transportation Average rallied to a five-month high this week, underpinned by bullish sentiment in reaction to COVID-19 curve-flattening across the Southern and Southwestern states. Package delivery services are leading the advance, with United Parcel Service, Inc. (UPS) surging to an all-time high. A steady airline bounce is also supporting the upside, after TSA reported the strongest air travel numbers since the pandemic began in the first quarter. Transport price action often predicts economic strength and weakness, with shipping volumes increasing in good times and decreasing in bad times. Many truckers are now trading near new highs, highlighting the resumption of commercial and industrial activity needed to support a full recovery in 2021 and beyond. Even so, sector performance has gotten ahead of actual metrics, with many U.S. businesses reporting steep second quarter revenue declines. Railroads are the wild cards in this equation, with Union Pacific Corporation (UNP) and CSX Corporation (CSX) now lifting toward June resistance. This transportation segment is more dependent on the energy industry than other components and will be affected if the West Texas Intermediate (WTI) crude oil futures contract rolls over in the lower $40s and heads down to levels struck during a historic decline that posted a negative number at the April low. The transportation sector is a category of companies that provide services to move people or goods, as well as transportation infrastructure. The transportation sector consists of several industries including air freight and logistics, airlines, marine, road and rail, and transportation infrastructure.  The iShares Transportation Average ETF (IYT) came public in the low $50s in 2003 and entered a strong uptrend that ended near $100 in 2008. The fund fell to an all-time low during the economic collapse and turned higher into the new decade, completing a 100% retracement into the prior high in the second quarter of 2011. Price action spent the next two years completing the handle of a multi-year cup and handle pattern that broke to the upside in 2013. The rally ended at $158 at the end of 2014, yielding a steep correction, followed by a bounce to resistance after the presidential election. An October 2017 breakout stalled at $206 in January 2018, while a failed September rally prompted a decline that posted a lower January 2020 high before breaking down to a four-year low in March. The fund remounted broken 2018 support at $155","Aug 7, 2020",https://www.investopedia.com/curve-flattening-lifts-transportation-stocks-5074137
15,American Airlines Group (NASDAQ:AAL) Raised to Sell at BidaskClub | MarketBeat,. . American Airlines Group (NASDAQ:AAL) Raised to Sell at BidaskClub. MOST READ THIS WEEK. RECENT ARTICLES. 30 Days of,"  American Airlines Group (NASDAQ:AAL) was upgraded by analysts at BidaskClub from a ""strong sell"" rating to a ""sell"" rating in a report issued on Friday, BidAskClub reports. A number of other equities analysts have also recently issued reports on the company. ValuEngine upgraded American Airlines Group from a ""buy"" rating to a ""strong-buy"" rating in a research report on Monday, June 1st. Citigroup upped their price target on American Airlines Group from $9.00 to $14.00 and gave the company a ""sell"" rating in a research report on Monday, June 15th. Zacks Investment Research lowered American Airlines Group from a ""hold"" rating to a ""sell"" rating and set a $10.00 price target on the stock. in a research report on Monday, May 18th. Cowen reiterated a ""buy"" rating on shares of American Airlines Group in a research report on Wednesday, June 24th. Finally, Deutsche Bank reiterated a ""buy"" rating and issued a $18.00 price target on shares of American Airlines Group in a research report on Monday, July 20th. Ten research analysts have rated the stock with a sell rating, seven have issued a hold rating, three have given a buy rating and one has given a strong buy rating to the company. The company has a consensus rating of ""Hold"" and an average price target of $15.63. NASDAQ:AAL opened at $13.04 on Friday. The stock has a fifty day moving average price of $12.54 and a 200-day moving average price of $15.77. The company has a market cap of $6.39 billion, a price-to-earnings ratio of -1.60 and a beta of 1.63. American Airlines Group has a fifty-two week low of $8.25 and a fifty-two week high of $31.67. American Airlines Group (NASDAQ:AAL) last posted its quarterly earnings results on Thursday, July 23rd. The airline reported ($7.82) EPS for the quarter, missing analysts' consensus estimates of ($7.03) by ($0.79). American Airlines Group had a negative return on equity of 124.31% and a negative net margin of 10.40%. The business had revenue of $1.62 billion for the quarter, compared to analyst estimates of $1.52 billion. During the same period last year, the firm posted $1.82 EPS. American Airlines Group's quarterly revenue was down 86.4% on a year-over-year basis. On average, analysts expect that American Airlines Group will post -18.92 EPS for the current fiscal year. Large investors have recently added to or reduced their stakes in the business. Mitsubishi UFJ","Aug 7, 2020",https://www.marketbeat.com/instant-alerts/nasdaq-aal-a-buy-or-sell-right-now/
16,"GOP senators, Trump back more aid for airlines as elections near | Aviation News | Al Jazeera","GOP senators, Trump back more aid for airlines as elections near. US Congress to vote on COVID aid package after","Republican senators support more relief aid for airlines that have warned of possible layoffs a month before elections. A group of 16 Republican senators has endorsed giving more money to airlines to avoid layoffs right before United States elections in November, giving a boost to a lobbying effort by airlines and their unions. In a letter to Republican and Democratic leaders, the GOP senators did not specify an amount on Wednesday, but a proposal by several airline unions would give the hard-hit aviation industry $32bn, including $25bn for passenger airlines. Late on Wednesday, US President Donald Trump also expressed support when asked about the senators’ letter. “We don’t want to lose our airlines so if they’re looking at that, whether they’re Republican or Democrat, I’d be certainly in favour,” Trump said at a White House briefing. Airline stocks rose. American Airlines, viewed as the most financially troubled among the major airlines, gained the most, closing up 9.5 percent. The senators said they support relief because air travel remains depressed and several airlines have warned of possible job cuts on October 1, when a prohibition on airline layoffs expires. They said Congress should also consider more help for airport concessionaires and aircraft manufacturers. In March, aviation companies got $32bn to help cover payroll costs for six months in exchange for not laying off workers. Nine of the 16 GOP senators who signed the letter are up for re-election in November and could be hurt by headlines about thousands of airline furloughs the month before voters go to the polls on November 3. Some of those senators face difficult re-election races, including Susan Collins of Maine and Cory Gardner of Colorado. Others represent states with large numbers of airline workers, such as John Cornyn of Texas. Senate Majority Leader Mitch McConnell of Kentucky made no provision for airline workers in his $1 trillion proposal for additional virus relief. A spokesman for McConnell had no comment. A majority in the House, including more than two dozen Republicans, have endorsed the spending. The Treasury Department has so far declined to comment on the Trump administration’s position. No US legislators have spoken out against the airline provision, although aides said some object to helping workers in one industry when there are millions of other workers who have already lost their jobs during the pandemic. Air travel is not expected to return to previous levels for","Aug 6, 2020",https://www.aljazeera.com/economy/2020/8/6/gop-senators-trump-back-more-aid-for-airlines-as-elections-near
17,Is Air Canada stock undervalued right now? - Cantech Letter,Is Air Canada stock undervalued right now?. About The Author / Nick Waddell. Cantech Letter founder and editor Nick Waddell,"   Wishpond begins trading BBTV sees Insider Buying Is Burcon Nutrascience still cheap?      Second quarter results coming in better than expected for Air Canada (Air Canada Stock Quote, Chart, News TSX:AC) but it’s the company’s new plan of action that’s impressing Paradigm Capital analyst Corey Hammill.  The analyst reviewed Air Canada’s quarter in an update to clients on Tuesday and kept his “Buy” rating and $30.00 target, saying the airline is transforming into a long-term sustainably profitable business. Montreal-headquartered Air Canada delivered its Q2 financials on July 31, with the overall quarterly revenue down a massive 89 per cent year-over-year and total passengers carried dropping by 96 per cent compared to Q2 2019. Air Canada CEO Calin Rovinescu said the COVID-19 pandemic has been devastating and that Canada’s federal and inter-provincial regulations in response to the health crisis have further hobbled the airline. Rovinescu pointed to a number of steps taken by management, including the raising of $5.5 billion in new equity, debt and aircraft financings since mid-March (putting the company at over $9 billion in liquidity as of June 30), a major management and front-line workforce reduction, a $1.3-billion reduction in fixed costs and capital investments, the permanent retirement of 79 aircraft and the indefinite suspension of some domestic routes and station closures.  “These were some of the painful but necessary steps we have taken to stabilize our airline and preserve cash in these uncertain times. We will now look to the future using this unprecedented challenge as an equally unprecedented opportunity to rebuild a smaller but even more nimble airline, with a simplified and younger fleet and a lower cost structure coming out of the crisis,” Rovinescu said in a press release. On the Q2, Air Canada managed revenue and EBITDA of $567 million (down from $4.7 billion for Q2 2019) and negative $832 million (down from $916 million a year ago), whereas Hammill was calling for revenue of $537 million and EBITDA of negative $1.6 billion. Hammill reported the news that the IATA recently revised its forecast on air travel recovery, which it now says will occur in 2024, while Air Canada’s management has said it’s expecting the recovery to take three years.  Despite these headwinds, Hammill says he’s “cautiously optimistic” in his long-term outlook for AC. “The business has been rebuilt to withstand shocks, which is","Aug 6, 2020",https://www.cantechletter.com/2020/08/is-air-canada-stock-undervalued-right-now/
18,Exclusive: Republican senators back extending US$25 billion payroll aid for US airlines; shares jump - CNA,. . . . . . . . . . Exclusive: Republican senators back extending US$25 billion payroll aid for," A group of 16 Senate Republicans on Wednesday backed extending a US$25 billion payroll assistance program for U.S. airlines who have warned they may be forced to cut tens of thousands of jobs after Sept. 30 without government action, according to a letter seen by Reuters. WASHINGTON: A group of Senate Republicans on Wednesday backed extending a US$25 billion payroll assistance program for U.S. airlines after warnings that carriers may be forced to cut tens of thousands of jobs without government action, according to a letter seen by Reuters. Airline stocks moved sharply higher on the news, which was first reported by Reuters. Shares of American Airlines were up 8.9per cent in afternoon trading while shares of United Airlines rose 6.3per cent. The letter, spearheaded by Senator Cory Gardner and addressed to Senate Majority Leader Mitch McConnell and Senate Minority Leader Chuck Schumer and copied to Treasury Secretary Steve Mnuchin, was the first public disclosure of significant support in the Republican-led Senate for additional emergency funding for U.S. airlines. Senators Marco Rubio, Roger Wicker, James Inhofe, James Risch, John Cornyn, Todd Young, Susan Collins, Martha McSally and others who signed the letter said they backed a new six-month extension of the US$25 billion payroll support program ""to avoid furloughs and further support those workers."" After Reuters reported the letter, Cornyn's office released a copy of it and declined further comment. Airline officials and unions have been urging U.S. lawmakers to extend new assistance in the face of the coronavirus epidemic's devastating impact on airline travel. ""With air travel anticipated to remain low in the near future, Congress should also consider provisions to support and provide flexibility for businesses across the aviation industry similarly impacted, such as airport concessionaires and aviation manufacturing,"" the letter said. On July 27, a majority of the Democratic-controlled U.S. House of Representatives signed a letter also calling for a six-month extension for the payroll aid program that they argue is crucial to keeping hundreds of thousands of aviation workers employed through March 31. That letter was signed by 195 Democrats and 28 Republicans. Congress awarded US$25 billion in payroll assistance to U.S. passenger airlines in March, along with US$4 billion for cargo carriers and US$3 billion for airport contractors. Most of the bailout funds do not have to be paid back. Sara Nelson, international president of the Association of Flight Attendants-CWA, which represents nearly 50,000","Aug 6, 2020",https://www.channelnewsasia.com/news/business/exclusive--republican-senators-back-extending-us-25-billion-payroll-aid-for-us-airlines--shares-jump-12993808
