,title,headers,text,date,link
14,FTSE 100 continues steady progress: Diageo hits the gin,We value your privacy. . . . . . . . . . . . . . . . .,"We and our
partners
store and/or access information on a device, such as cookies and process personal data, such as unique identifiers and standard information sent by a device for personalised ads and content, ad and content measurement, and audience insights, as well as to develop and improve products. With your permission we and our partners may use precise geolocation data and identification through device scanning. You may click to consent to our and our partners’ processing as described above. Alternatively you may access more detailed information and change your preferences before consenting or to refuse consenting. Please note that some processing of your personal data may not require your consent, but you have a right to object to such processing. Your preferences will apply to this website only. You can change your preferences at any time by returning to this site or visit our privacy policy.           17:02 Mon 17 Aug 2020 Follow John on: Britain's blue chip benchmark finished up over 37 points, or 0.61%, at 6,127 FTSE 100 index closed in the green on Monday as mining stocks did well on the back of higher metals prices. Britain's blue chip benchmark finished up over 37 points, or 0.61%, at 6,127.  ""European equity benchmarks are broadly higher even though the headlines have been a touch on the negative side,"" noted David Madden, market analyst at CMC Markets. ""Concerns persist in relation to the pandemic, both in terms of the infection rate, and the fear of tougher restrictions being imposed again. US-China trade talks were due to take place at the weekend, but they were cancelled, and no replacement date has been set. This isn’t a major upset to their relations, but it adds to the sour sentiment that has been building between the two countries for a while."" Gold continued its ascent, up 2.17% to US$1,992 an ounce. Polymetal International PLC (LON:POLY) was second biggest riser on Footsie, up 2.8% to 2,034p. Anglo American (LON:AAL) was also a top riser, up 2.83% to 1,932.4p. Wall Street shares were mixed in early deals on Monday. The Dow Jones Industrial Average shed around 30 points at 27,900. The S&P 500 added around 12 points at 3,385. The tech-heavy Nasdaq surged over 90 points at 11,109. In Toronto, Canada, the S&P/TSX index was up over 98 points at 16,613. Predictmedix Inc (CSE:PMED) (OTCQB:PMEDF)","Aug 17, 2020",https://www.proactiveinvestors.co.uk/companies/news/926765/ftse-100-finishes-higher-monday-as-miners-boosted-pandemic-fears-remain-926765.html
15,Has easy online investing created a ticking time bubble? | Stuff.co.nz,. . . . . . . opinion analysis. Has easy online investing created a ticking time bubble?. most popular.,"    Trustworthy, accurate and reliable news stories are more important now than ever. Support our newsrooms by making a contribution. OPINION: Over the last few months, I’ve had many friends ask me if stocks such as Air New Zealand “are good shares to buy right now”. Many of them have never bought shares before. This highlights to me just how real the current retail euphoria in stock markets is. It also prompted me to investigate the impact retail investors are having on markets right now. So, what’s driving this meteoric rise of the retail investor? There are a few factors at play. Pre-Covid-19, share trading by small investors was already percolating. The movement was being stoked by discount broking platforms and the onset of slick investor platforms that facilitate easy online trading. READ MORE:
* Cannabis referendum: Is now a good time to invest in cannabis stocks?
* 'Big Short' investor Michael Burry sounds alarm on passive investment
* Shares for Christmas? Yes, that's a real thing Fractional share ownership, popularised by innovative platforms like Sharesies, allows retail players to buy shares cheaply. It makes investing widely accessible. When Covid-19 hit, it was a perfect storm. Quarantine boredom during lockdown combined with the sharp fall in equities created a massive surge in retail investor buying.  Punters were ripe for it with a silent refrain that went something like this: “I can’t go to the casino or get involved in a sports bet with the season on hold, so I’ll have some fun trading the stock market.” The four major US retail brokers reportedly picked up a million new customers over March and April. Outstripping them all though was Robinhood, the app-based pioneer of zero-fee trading. Robinhood’s customer base was a mirror for sports betting; risk-taking men aged 25-34 looking for a thrill or easy money. They’ve become a big, opaque, driving force of risk, especially over the short time horizons, accounting for 20 per cent per cent of retail investment flows in the US. But this is not just a US-centric story. Closer to home, research from corporate advisory firm Vesparum Capital highlights Australian retail investors were net buyers of A$9 billion (NZ$9.79b) in equities between late February and mid-May, while institutional investors have fled the market to the tune of A$11b. In China, the local market is surging, and five years after China’s last big-equity boom ended in","Aug 17, 2020",https://www.stuff.co.nz/business/opinion-analysis/300082862/has-easy-online-investing-created-a-ticking-time-bubble
16,Will Air Canada (TSX:AC) Stock Rise 100% by the End of 2020?,. S&P/TSX. S&P 500. DOW. CAD/USD. CRUDE OIL. BTC-CAD. CMC Crypto 200. GOLD FUTURES. RUSSELL 2000. 10-Yr Bond. NASDAQ. VOLATILITY.," Air Canada (TSX:AC) stock can rise 50 times in value. Don’t believe me? Just look at its history. In 2012 shares were under $1. By 2019, they topped $50. A $5,000 investment would have become $250,000! The coronavirus ruined the party. Nearly every airline stock has been slammed, and Air Canada is no exception. Today, the stock trades at $16 at writing. Many investors believe the current valuation is an outright bargain. Even if shares were to double in value, they’d still be 40% below their former highs. Air Canada stock fell 70% in a matter of months. Could a 100% rise occur with such speed, perhaps before the end of 2020? One thing is clear: nothing is clear. Visibility into the future has never been lower for airline operators. Just ask Air Canada CEO Calin Rovinescu. “This is hundreds of times worse than 9/11, SARS, or the global financial crisis — quite frankly combined,” he said. “We never got to the level when we were only operating at 5% in any of those circumstances, you know, other than the three days of shut-down post 9/11.” He concluded somberly: “This is catastrophic territory.” But as Warren Buffett often advises, sometimes it’s best to buy when others are fearful. Right now, Air Canada is operating at 5% of its typical capacity, which is unprecedented. Even a whiff of a return to normal could send shares soaring. Think about it this way: If traffic is 80% lower next quarter compared to history, Air Canada would quadruple its passenger revenues! Business really can’t get worse. Neither could sentiment. These are exactly the conditions necessary for a quick double. But the ability for a stock to double in price doesn’t necessarily make it a worthwhile investment. What if there’s a 1% chance of doubling, and a 99% chance of bankruptcy? Few would take that bet. To determine the odds of doubling, we first need to determine the odds of absolute failure. Last quarter, Air Canada lost more than $1 billion. The quarter before that, losses also totalled more than $1 billion. With 85% of Canadians preferring travel restrictions to remain in place, and passengers with COVID-19 continuing to enter the country, we should expect another major loss in the coming quarter, possibly throughout the end of the year.               ","Aug 17, 2020",https://ca.finance.yahoo.com/news/air-canada-tsx-ac-stock-115847139.html
17,Flybe investors plan legal fight over 1p deal | This is Money,. Former Flybe shareholders preparing legal action over claims they were misled about airline's performance before it was sold in,"By FRANCESCA WASHTELL FOR THE DAILY MAIL PUBLISHED: 21:52 GMT, 16 August 2020 | UPDATED: 21:52 GMT, 16 August 2020  24 View
comments  Former Flybe shareholders are preparing legal action over claims they were misled about the airline's performance before it was sold in a cut-price deal last year.  Several dozen retail investors want a judge to decide if former directors put out inaccurate statements and overstated how well the company was doing.  The shareholders' investments were wiped out after they received just 1p per share when it was sold in early 2019 to a group called Connect Airways, which was led by Sir Richard Branson's Virgin.   The budget airline's stock had been trading at 16.4p per share, valuing it at £36m, the day before the rescue deal was announced.  But the 1p offer was 94 per cent lower than this and left the amount owed to shareholders at just £2.2m, even though the airline raised another £2.8m by selling assets. Flybe had put itself up for sale in late 2018 after running into financial difficulties.  Connect bought Flybe, but the airline eventually went bust this year after the coronavirus crisis hit bookings and the Government refused to hand it a £100m bailout loan.  The former shareholders want to claim compensation and have hired a UK law firm to put together a case to see if they can take ex-directors including then-chairman Simon Laffin and chief executive Christine Ourmieres-Widener to court.  One investor, who did not wish to be named, lost £350,000 because of the rock-bottom sale price.  The investor said: 'First, the impact this has had on me as an individual is irreversible. Life changing measures have had to be made including having to sell assets etc to survive. Mentally this has also been very challenging.'  Another investor said: 'The use of language, often repeated by the board, to stimulate investment, maximise shareholder value and provide for a stable and positive future for the business, was influential in my decision to invest.'  A spokesman for the law firm said: 'We are exploring the merits of a potential claim by shareholders against the former directors of Flybe for their alleged misconduct and mishandling of the company's affairs. We are analysing the prospects of recovery and whether the board has insurance.  'We will be considering the robustness of","Aug 16, 2020",https://www.thisismoney.co.uk/money/markets/article-8633073/Flybe-investors-plan-legal-fight-1p-deal.html
18,What did Warren Buffett buy?,. . . . What did Warren Buffett buy?. Recent in Library. Emerging Markets Outlook 2021. How RIAs and MFDs,"Much like the first quarter, Berkshire Hathaway was a net seller of stocks during the June 2020 quarter, reporting $10.9 billion in net proceeds from its purchases and sales. Buys Berkshire increased its stakes in Liberty Media SiriusXM, Store Capital, Kroger, and Suncor Energy. And picked up 21 million shares of Barrick Gold for an estimated $470 million. How to make money in gold mining stocks It should be noted that each of these holdings accounted for less than 1% (if not less than 0.5%) of Berkshire's $202.4 billion portfolio at the end of the second quarter. Berkshire also picked up an additional 108 million shares of Bank of America since the start of the third quarter. Why Buffett has not made any big investments Sales As for the sales, the largest was JPMorgan Chase, with Berkshire selling 36 million shares for an estimated $3.3 billion. The company also reduced its stake in Wells Fargo by close to a third, selling 86 million shares for an estimated $2.3 billion, and trimmed holdings in PNC Financial, Bank of New York Mellon, and M&T Bank. There were also reductions in Berkshire's stakes in Visa and Mastercard, further reducing its commitment to financial services stocks during the quarter. Buffett’s changing stance on the airline industry Eliminations Berkshire eliminated its stakes in the four major airlines--American Airlines, Delta Air Lines, Southwest Airlines, and United Airlines--as well as Goldman Sachs in April 2020. The sales of the four airline stocks netted the firm an estimated $5.2 billion, while the sales of shares of Charter Communications, Occidental Petroleum, Restaurant Brands, and SiriusXM radio likely brought in another $1 billion.","Aug 17, 2020",https://www.morningstar.in/posts/59503/warren-buffett-buy.aspx
