,title,headers,text,date,link
10,"After EOI submission, Synergy Group eyes 49% stake in Jet Airways | Business Standard News",". . After EOI submission, Synergy Group eyes 49% stake in Jet Airways. Govt norms mandate that substantial ownership and","By continuing to use this site you consent to the use of cookies on your device as described in our Cookie Policy unless you have disabled them. You can change your Cookie Settings at any time but parts of our site will not function correctly without them. Topics
Jet Airways crisis | Jet Airways Aneesh Phadnis & Subrata Panda  |  Mumbai 
Last Updated at August 28, 2019 21:55 IST STOCK PRICE - CLICK HERE FOR MORE BSE 111.505.30 (4.99%) NSE 110.605.25 (4.98%) South America’s Synergy Group Corp is planning to pick up 49 per cent stake in Jet Airways. It will discuss co-investment options with its lenders and infrastructure companies, the group’s advisor told Business Standard. Synergy Group Corp, which owns majority stake in Avianca Airlines, South America’s second-largest airline, submitted an expression of interest last week to revive the grounded airline. It’s Bolivian born founder German Efromovich will visit India next month to discuss investment options with Jet’s lenders and Indian infrastructure companies. Government norms mandate that substantial ownership and effective control of an airline must rest with Indian citizens. “We intend to structure the acquisition as a foreign company with 49 per cent stake. Jet Airways is publicly listed and we hope lenders would be willing to convert their debt into equity. We will also discuss partnerships with Indian infrastructure companies. We have several options,” said Antonio Guizzetti, president of consultancy G&A, which is advising the Synergy Group regarding the stake buy. Jet Airways, which shut down in April following a cash crunch, had a debt of around Rs 8,500 crore. Ashish Chhawchharia, the resolution professional handling the airline’s insolvency, has received creditor claims of over Rs 30,000 crore and admitted claims of around Rs 12,000 crore. ALSO READ: Jet Airways crisis: Lenders extend expression of interest deadline again  “The amount of investment by the Synergy Group will depend on discussions and negotiations with banks and other creditors. In insolvency cases, it is common to negotiate for discount on debt,” he said. Efromovich purchased Avianca, which went through bankruptcy in 2004. Since then, he has transformed it into the second largest airline in South America. However, Efromovich is facing a crisis and had to step down from the chairman’s post of Avianca Holdings following a loan default. He is now waging a legal battle to retain control of his majority stake in Avianca after a loan","Aug 28, 2019",https://www.business-standard.com/article/companies/after-eoi-submission-synergy-group-eyes-49-stake-in-jet-airways-119082801635_1.html
11,5 Drone Stocks You Shouldn't Sleep On,. . 5 Drone Stocks You Shouldn’t Sleep On. Best Drone Stocks: Top-5 Picks. Boeing Co. (NYSE: BA). Textron (NYSE:,"Chris Dios - August 29, 2019 Explore more of our cheap stocks watchlists: Boeing is one of the biggest companies in the Dow Jones Index, but the firm is having big problems with the 747 MAX. Regardless, it’s one of the leading developers of drone technology. The company produces a wide variety of drones, including models that can refuel planes, land on aircraft, and even carry up to 500 lbs of cargo. The company’s undeniably strong relationship with the U.S. government gives it a huge advantage. Government clients will surely be interested in Boeings high-tech UAVs. For these facts alone, BA is one of our top drone stocks.  Out of all of the companies on this week’s list, AeroVironment is the only one that makes the majority of its revenues from drones. Although this company is small compared to the other massive-cap conglomerates on this week’s list, it’s the best pure-play drone stock in the lineup. In addition to drones, the firm also produces flight systems for military and civilian clients. Earnings are growing at a 94% clip from the previous TTM, and the stock is starting to look cheap after a long consolidation.  An aerospace/military-industrial company, Raytheon makes high-tech gear for military and civilian clients, including the U.S. military. Be aware that Raytheon plans to merge with industrial conglomerate United Technologies (UTI). The deal is awaiting regulatory approval, and headlines could affect share prices as the merger develops. Regardless, the firm is a leading producer of drone technology. Raytheon is even developing small swarm drones that use advanced AI to work in unison. Regardless The company is working with DARPA, the U.S. governments advanced military research arm, to develop its swarm AI. Europe’s answer to Boeing, Netherlands-base Airbus is also a big player in the drone game. The Wall Street Journal recently featured the firm in an article on stratospheric drones because of its advances in the field. In addition, the firm has several other promising models in the pipeline. The stratospheric drone runs around-the-clock on solar-powered batteries, doing lazy loops in the upper stratosphere for days on end. Proponents of the technology believe stratospheric drones are cheaper and more flexible than spy satellites. Thanks for reading! If you enjoyed our picks, be sure to give us a shoutout in the comments. Don’t forget to signup for FREE Dork Alerts for exclusive hot stock watchlists and in-depth","Aug 29, 2019",https://www.thestockdork.com/drone-stocks/
12,"Vietjet pays $101 million on share buyback - Economy - Vietnam News | Politics, Business, Economy, Society, Life, Sports - VietNam News",. Vietjet pays $101 million on share buyback. . Send Us Your Comments:. See also:. HIGHLIGHT. E-PAPER. . . .,"  HÀ NỘI – Budget airline Vietjet (VJC) has repurchased 17.77 million shares of the company on the stock market, equivalent to nearly 3.3 per cent of the airline’s charter capital, the company said. This number of shares was lower than its initial buyback plan of 25 million shares. The average buying price was VNĐ132,062 (US$5.67)  per share which meant the airline spent nearly VNĐ2.35 trillion (roughly $101 million) on the buyback. In its filing to the Hồ Chí Minh Stock Exchange on Wednesday, the company attributed the reason for not buying the number of registered shares to inadequate liquidity in the market. After the purchase, outstanding Vietjet shares decreased from 541.6 million to 532.84 million. According to market analysis, the current price of Vietjet’s shares is at a good range for the company to invest. Many securities companies have reckoned Vietjet’s shares would be included in the portfolios of the two exchange-traded funds – FTSE Vietnam UCITS ETF and VanEck Vectors Vietnam ETF – in their last quarter restructuring this week. Shares of the company dropped 0.3 per cent on Thursday to VNĐ132,000 a share. In the first half of this year, the airline reported an increase of nearly 24 per cent in total revenue to VNĐ23.6 trillion and 4.3 per cent rise in net profit of VNĐ2.08 trillion. In recent times, many big companies and banks have registered to buy back a large number of treasury shares to stabilise their prices in the stock market. Hồ Chí Minh Development Bank (HDB) are seeking shareholders’ opinions on buying back shares with a maximum rate of 5 per cent of its total outstanding shares. Meanwhile, Vietnam Prosperity Bank (VPB) approved a repurchase plan of up to 10 per cent of its total shares. In March, Military Bank (MBB) bought back 47 million shares out of its total 108 million shares. – VNS Copyrights 2012 Viet Nam News, All rights reserved .Add:79 Ly Thuong Kiet Street, Ha Noi, Viet Nam. Editor_In_Chief: Trinh Thanh Thuy
Tel: 84-24-39332316; Fax: 84-24-39332311 E-mail: vnnews@vnagency.com.vn
Publication Permit: 381/GP-BTTTT.","Aug 29, 2019",http://vietnamnews.vn/economy/534737/vietjet-pays-101-million-on-share-buyback.html
13,Access to this page has been denied.,"To continue, please prove you are not a robot"," To ensure this doesn’t happen in the future, please enable Javascript and cookies in your browser.
Is this happening to you frequently? Please report it on our feedback forum. If you have an ad-blocker enabled you may be blocked from proceeding. Please disable your ad-blocker and refresh. Reference ID: c527da60-4212-11eb-a8e5-bd7f2b2d3e35","Aug 29, 2019",https://seekingalpha.com/article/4288820-delta-air-lines-building-track-record-of-dividend-growth
14,First new Midwest Express plane lands at MKE - Milwaukee Business Journal,. . . . . . . . . . . . . . . . . . . .,"One of the first new Midwest Express Airlines jets landed at Milwaukee Mitchell International Airport Aug. 28. HTTPS://TWITTER.COM/MITCHELLAIRPORT Midwest Express Airlines Inc. Milwaukee, WI See full profile General Mitchell International Airport Milwaukee, WI See full profile Midwest Express Airlines is back in Milwaukee and so are the signature baked in-flight chocolate chip cookies. Midwest Express president Greg Aretakis announced Wednesday at Milwaukee Mitchell International Airport the initial departures for the Milwaukee-based airline making its return after nearly a decade hiatus from the skies. Beginning at the end of the year, Midwest Express will offer nonstop flights to Grand Rapids, Michigan; Omaha, Nebraska; and Cincinnati. “We’re here to celebrate the next milestone with the return of Midwest Express back to Milwaukee,” Milwaukee airport director Brian Dranzik said to a round of applause at the morning press conference. Earlier this month, Midwest Express announced its agreement with Portland, Maine-based Elite Airways LLC, which will supply the flight operations, including the aircraft for Midwest Express. Midwest Express unveiled the new Elite Airways-operated Bombardier CRJ 200 at the Wednesday press conference. The plane had a new look compared with the signature blue, red and yellow Midwest planes. The 50-seat aircraft featured yellow and blue trim on white with the initials ME on the tail and Midwest Express along the side of the aircraft. Midwest Express Airlines filed a private stock offering in May 2018 with the U.S. Securities and Exchange Commission with the intent to resurrect the popular hometown airline. Midwest Express changed its name to Midwest Airlines in 2004 and later merged with Frontier Airlines in 2010. “Midwest was always a partnership between the city of Milwaukee, the Milwaukee business community and this airport and the service that we provide. It was for many years. It’s been gone for many years and once again the partnership is coming back,” Aretakis said. Former Midwest Express customers will be pleased to return to the comfortable two-by-two leather seating on the aircraft. The Midwest Express-branded jets touched down at Mitchell International Airport Wednesday.  But the signature large leather seats were not the primary thing that former customers wanted, Aretakis said. “Everyone was asking for convenience,” Aretakis said. “The great customer service that Midwest was famous for was the second thing.” Elite Airways president John Pearsall said the partnership with Midwest Express worked because Elite Airways, which operates on the East Coast, is focused on high","Aug 28, 2019",https://www.bizjournals.com/milwaukee/news/2019/08/28/midwest-express-begins-long-awaited-comeback-with.html
15,CNN: Trump Lied to Pump the Flailing Stock Market,"We value your privacy. CNN: Trump Lied to Pump the Flailing Stock Market. Trump Lied, Nobody Died – Does Anyone","We and our
partners
store and/or access information on a device, such as cookies and process personal data, such as unique identifiers and standard information sent by a device for personalised ads and content, ad and content measurement, and audience insights, as well as to develop and improve products. With your permission we and our partners may use precise geolocation data and identification through device scanning. You may click to consent to our and our partners’ processing as described above. Alternatively you may click to refuse to consent or access more detailed information and change your preferences before consenting. Please note that some processing of your personal data may not require your consent, but you have a right to object to such processing. Your preferences will apply to this website only. You can change your preferences at any time by returning to this site or visit our privacy policy. By: Francois Aure | Email | Leave a comment It appears that stock market investors might not be the only ones feeling the heat from the US-China trade war. In a bombshell leak from Donald Trump’s private aides, CNN confirms the rumor that President Trump lied about the phone call with China to pump flailing US stocks. CNN reports (emphasis added): “Though Trump and Treasury Secretary Steven Mnuchin insisted there had been “communication,” aides privately conceded the phone calls Trump described didn’t happen they way he said they did. Instead, two officials said Trump was eager to project optimism that might boost markets, and conflated comments from China’s vice premier with direct communication from the Chinese.” For many traders, this revelation won’t come as much of a surprise. Prominent fund manager and TV host Jim Cramer made it clear that he believes it doesn’t matter that Trump lied because it signals something much more important: that he might be softening on China. Trump now admits that he made up the late night phone call from China so as to manipulate the stock market higher. Private citizens have actually been prosecuted for doing that for personal financial gain. I guess it's OK for a president to do it for personal political gain. — Peter Schiff (@PeterSchiff) August 29, 2019  Trump has used the stock market as a clear barometer of his trade policy and has stepped in on multiple occasions when sell-offs have been getting out of hand. Previously labeled as a “market-friendly”","Aug 29, 2019",https://www.ccn.com/cnn-trump-lie-stock-market/
16,"Starting now, United Airlines’ frequent-flier miles will never expire - MarketWatch","MarketWatch Site Logo A link that brings you back to the homepage. .mwA1{fill:#ffffff;} .mwA2{fill:#4db74d;}. Starting now, United Airlines’ frequent-flier miles","Frequent fliers on United Airlines will no longer have to worry about using their award miles before they expire. The Chicago-based airline announced Wednesday that its MileagePlus reward miles will never expire, effective immediately. Previously, unused miles expired after 18 months if there was no account activity. “We want to demonstrate to our members that we are committing to them for the long-haul and giving customers a lifetime to use miles is an exceptionally meaningful benefit,” Luc Bondar, United’s president of MileagePlus, said in a statement. MileagePlus rewards can be used on flights, hotels, in-flight amenities, car rentals and more. United joins Delta Air Lines DAL, -1.05%   and JetBlue Airways JBLU, +0.49%   with lifetime miles for its loyalty members. American Airlines AAL, -1.73%   miles expire after 18 months of inactivity, while Southwest Airlines LUV, -0.78%   and Alaska Airlines ALK, +0.36%   give members 24 months to use or lose their miles. United shares UAL, -2.48%   are down 1.5% year to date, compared to the S&P 500’s SPX, -0.35%   15% gain in 2019. Tesla Inc. is set to join the U.S. equities' major leagues on Monday, a relatively routine move turned unprecedented by the sheer size of the Silicon Valley electric-car maker's market valuation. You are approaching your article limit. Get unlimited access.   ","Aug 28, 2019",https://www.marketwatch.com/story/starting-now-united-airlines-frequent-flier-miles-will-never-expire-2019-08-28
17,End of days? Jet Airways to vacate headquarters in 45 days - The Financial Express,End of days? Jet Airways to vacate headquarters in 45 days. Luckystar had moved the tribunal in last month seeking,"Jet Airways will vacate Siroya Centre, the premises where it is currently headquartered in Mumbai, in the next 45 days. The legal counsels of the resolution professional (RP) for the defunct airline and Luckystar, the owner of the property, informed the National Company Law Tribunal (NCLT) that the parties are very close to reaching a settlement on the matter. The RP also sought more time from the tribunal to present a final list of resolution applicants for the airline. Luckystar had moved the tribunal in last month seeking to remove the airline’s headquarters from the disputed premises as Jet’s lease had expired on June 7. The committee of creditors (CoC), in its meeting earlier this week, has broadly agreed to the settlement terms put forth by Luckystar. Also read| Trade financing: How Credit Guarantee Fund for factoring may solve liquidity crunch for MSMEs The RP informed the tribunal that the deadline has been extended for submission of expressions of interest for Jet Airways, adding that two parties so far have been provisionally short listed as eligible resolution applicants. Earlier this week, the CoC decided to extend the EoI submission deadline to August 31 to allow some time to South American Synergy Group, the owner of Avianca Airlines. The Synergy Group had evinced interest in the airline last week, after the initial deadline to submit EoIs had already passed on August 10. Russian fund Treasury RA Creator is the other entity that has been provisionally shortlisted.
The Synergy Group has been in ongoing discussions with the RP regarding the defunct airline. The RP also sought additional time from the court to present the final list of eligible resolution applicants. The RP will now submit the next progress report on the resolution of Jet Airways on September 20. A two-member bench at NCLT Mumbai admitted Jet Airways for insolvency on June 20. While passing the oral order, Judge VP Singh called the resolution of the airline a matter of “national importance” and urged the RP to complete the process within 90 days. The airline was grounded on April 17 after lenders refused to provide emergency funding to continue operations. Slots belonging to Jet Airways have since been allotted to other airlines.  Subscribe to Financial Express' weekly SME newsletter for latest and all-round coverage from the world of the biggest business in India - the Micro, Small and Medium Business. Get live Stock","Aug 29, 2019",https://www.financialexpress.com/industry/jet-airways-to-vacate-headquarters-in-45-days/1689468/
