,title,headers,text,date,link
10,Should Singapore Airlines Limited’s (SGX:C6L) Weak Investment Returns Worry You? - Simply Wall St News,Should Singapore Airlines Limited’s (SGX:C6L) Weak Investment Returns Worry You?. Understanding Return On Capital Employed (ROCE). How Do You Calculate,"Today we are going to look at Singapore Airlines Limited (SGX:C6L) to see whether it might be an attractive investment prospect. Specifically, we'll consider its Return On Capital Employed (ROCE), since that will give us an insight into how efficiently the business can generate profits from the capital it requires. Firstly, we'll go over how we calculate ROCE. Second, we'll look at its ROCE compared to similar companies. Finally, we'll look at how its current liabilities affect its ROCE. ROCE measures the 'return' (pre-tax profit) a company generates from capital employed in its business. All else being equal, a better business will have a higher ROCE. Ultimately, it is a useful but imperfect metric. Renowned investment researcher Michael Mauboussin has suggested that a high ROCE can indicate that 'one dollar invested in the company generates value of more than one dollar'. Analysts use this formula to calculate return on capital employed: Return on Capital Employed = Earnings Before Interest and Tax (EBIT) ÷ (Total Assets - Current Liabilities) Or for Singapore Airlines: 0.045 = S$1.1b ÷ (S$32b - S$8.1b) (Based on the trailing twelve months to June 2019.) So, Singapore Airlines has an ROCE of 4.5%. Check out our latest analysis for Singapore Airlines When making comparisons between similar businesses, investors may find ROCE useful. Using our data, Singapore Airlines's ROCE appears to be significantly below the 6.3% average in the Airlines industry. This performance could be negative if sustained, as it suggests the business may underperform its industry. Putting aside Singapore Airlines's performance relative to its industry, its ROCE in absolute terms is poor - considering the risk of owning stocks compared to government bonds. It is likely that there are more attractive prospects out there.  It is important to remember that ROCE shows past performance, and is not necessarily predictive. Companies in cyclical industries can be difficult to understand using ROCE, as returns typically look high during boom times, and low during busts. This is because ROCE only looks at one year, instead of considering returns across a whole cycle. Future performance is what matters, and you can see analyst predictions in our free report on analyst forecasts for the company. Current liabilities include invoices, such as supplier payments, short-term debt, or a tax bill, that need to be paid within 12 months. Due to the way ROCE is calculated, a high level of current liabilities makes","Sep 10, 2019",https://simplywall.st/stocks/sg/transportation/sgx-c6l/singapore-airlines-shares/news/should-singapore-airlines-limiteds-sgxc6l-weak-investment-returns-worry-you-2
11,Investment Lessons 18 Years After the 9/11 Attacks - TheStreet,. . Investment Lessons 18 Years After the 9/11 Attacks. 10 Best Stocks in the Dow This Past Week: McDonald's,"iStock   I'm not faulting the more than 100 million U.S. residents who either hadn't even been born on that fateful day, or who were too young to be aware of what was happening. But the rest of us have no excuse. And it's inevitable that, someday, there will be another crisis of the magnitude of the 9/11 terrorist attacks.  That's a remarkably quick recovery from one of the most traumatic events in U.S. history. But it is consistent with how the markets fared following prior geopolitical crises, according to analysis conducted by Ned Davis Research. The firm studied what it considered to be the 28 worst crises over the six decades prior to the 9/11 attacks, and found that, on average within six months, the Dow was higher than where it stood the day before those crises erupted. Perhaps the most remarkable illustration of this recovery phenomenon, though, is how the airline industry fared after the 9/11 attacks. That industry was perhaps the most impacted of any, with many people swearing off ever flying again. Many individual airlines were forced to rely on government bailouts or seek bankruptcy protection. Nevertheless, as you can see from the accompanying chart, the airline industry (as measured by the NYSE Arca Airline Index) by March 2002 was essentially back to where it stood on the day before the terrorist attacks. That's in just six months. To be sure, the markets don't always recover so quickly and impressively from a crisis. In nine of the 28 crises in the Ned Davis study, for example, the market in six months' time had failed to climb back to where it stood prior to the crisis. But even if a quick recovery is not guaranteed, you can be assured that selling into a market panic will secure you some of the worst possible sale prices. The best advice is that, if you didn't get out before the crisis hit the market, you should simply sit on your hands and wait. I acknowledge that it is unseemly to even be discussing your portfolio net worth in the context of a tragedy that led to immeasurable human loss and suffering. But think about it this way: You help no one during any crisis by thinking about your portfolio. And the message of history is that you don't have to.","Sep 10, 2019",https://www.thestreet.com/markets/investment-lessons-18-years-after-the-9-11-attacks-15083451
12,Why Did So Many Major US Airlines Decline In The 1980s? - Simple Flying,Why Did So Many Major US Airlines Decline In The 1980s?. Airline deregulation. Increased pressure. Major shakeup. Sumit Singh. Related," Deputy Editor - Sumit comes to Simple Flying with more than eight years’ experience as a professional journalist. Having written for The Independent, Evening Standard, and others, his role here allows him to explore his enthusiasm for aviation and travel. Having built strong relationships with Qatar Airways, United Airlines, Aeroflot, and more, Sumit excels in both aviation history and market analysis. Based in London, UK.    Sign up to our daily aviation news digest. Be in the know. When autocomplete results are available use up and down arrows to review and enter to go to the desired page. Touch device users, explore by touch or with swipe gestures.","Sep 9, 2019",https://simpleflying.com/major-airline-decline-1980s/
13,"Air Canada falls, Kirkland jumps after Canadian index rejig - BNN Bloomberg",. BNN. INVESTING. . Banks don't control any part of their business model: Dick Bove. . INVESTING. News Wire. Air,"    Latest Videos  This doesn't make any sense to us: CFIB CEO on Ontario restrictions Hedge funds see healthcare as an active sector in 2021: TD Securities' Mithra Warrier BNN Bloomberg's closing bell update: December 18, 2020                                                                                                  Sep 9, 2019  Divya Balji and Aoyon Ashraf, Bloomberg News Air Canada fell as much as 1.5 per cent on Monday after the stock was unexpectedly left out of a reshuffle of the S&P/TSX 60 Index and Kirkland Lake Gold Inc. added instead. Kirkland Lake rose 2.8 per cent at 9:50 a.m. in Toronto after the announcement late Friday; Husky Energy Inc. was removed in the changes. S&P Dow Jones is still set to announce the changes for the TSX composite on Sept. 13. The index changes -- important in the age of passive investing since they drive the composition of exchange traded funds -- may turn out to be the biggest news in what’s expected to be a relatively quiet week. Expect CannTrust Holdings Inc. to be among those ejected from the composite index after it fell beneath its listing price of $2.50. Kirkland Lake has soared 80 per cent this year amid gold’s safe-haven rally and is up 675 per cent over three years. Air Canada had climbed more than 300 per cent since 2016 and is the best-performing stock in the Bloomberg World Airlines Index this year. The carrier’s performance has been boosted this year by its planned acquisition of tour operator Transat AT, which will accelerate its global presence in the leisure industry.  CannTrust, on the flipside, has fallen almost 85 per cent from its 2018 peak. A demotion from the TSX would mean it has spent a mere six months in the index.   To be eligible for index inclusion, a stock must have","Sep 9, 2019",http://www.bnnbloomberg.ca/friday-the-13th-won-t-be-all-bad-for-canada-stocks-rejig-1.1313164
14,Battle of the Airlines: Why I Think United Airlines Is the Best,"Battle of the Airlines: Why I think United Airlines is the best. HEY, COULD YOU HELP US OUT?. Newark Airport.","This post contains references to products from one or more of our advertisers. We may receive compensation when you click on links to those products. Terms apply to the offers listed on this page. For an explanation of our Advertising Policy, visit this page. Let us know your thoughts on the state of travel. TAKE OUR TPG POLL! Editor’s note: It’s no surprise that TPG writers and editors have favorite airlines. So we decided to do a battle that covers the top four U.S. carriers. Check out the September 9 episode of the Miles Away podcast to hear us defend our airlines. And click on the links below to read which airlines we chose and why. Further reading: Podcast: TPG staffers debate their favorite airlines Further Reading: Battle of the Airlines: Why I think American Airlines is the best Further Reading: Battle of the Airlines: Why I think Delta Air Lines is the best Further Reading: Battle of the Airlines: Why I think Southwest Airlines is the best TPG Editor-at-Large Zach Honig is well known around the office for being The Points Guy’s most frequent United Airlines flyer. Below, he explains why, despite its flaws, United is often his first choice. Related: TPG Special Report: The 2019 List of Best and Worst U.S. Airlines No airline is perfect — at home or abroad — but in my years of business travel, I’ve found more to like about United Airlines and the Star Alliance than the other major U.S. carriers and international groups. I’m not going to argue that United is the best U.S. airline, overall, but it has been the best fit for me. Most frequent flyers end up choosing an airline based primarily on convenience — proximity to the hub and nonstop destinations. When it comes to United, that’s been the most significant factor for me. As a Lower Manhattan resident, without traffic ahead of an early-morning flight, I can get to Terminal C in roughly 20 minutes, and once I’m there, I can get to most of the places I visit without a stop. And Terminal C is far more comfortable to travel through these days, especially if I have time for a pre-flight stop at Classified. Sure, there’s been some criticism of United’s new seat — it can feel a bit tight to larger flyers — but as a traveler of average size, I find it to",23 hours ago,https://thepointsguy.com/news/battle-airlines-why-united-airlines-is-the-best/
15,,,,"Sep 10, 2019",https://www.research.hsbc.com/C/1/1/339/PddhnSH
16,Bloomberg - Are you a robot?,Bloomberg. We've detected unusual activity from your computer network. Why did this happen?. Need Help?,"To continue, please click the box below to let us know you're not a robot. Please make sure your browser supports JavaScript and cookies and that you are not blocking them from loading. For more information you can review our Terms of Service and Cookie Policy. For inquiries related to this message please contact our support team and provide the reference ID below.","Sep 9, 2019",https://www.bloomberg.com/news/articles/2019-09-09/air-france-klm-slumps-on-disappointing-peak-season-bookings
17,Dow Lurches Lower as Boeing Scandal Takes ‘Explosive’ Twist,"We value your privacy. Dow Lurches Lower as Boeing Scandal Takes ‘Explosive’ Twist. Dow Reverses Triple-Digit Gain, Briefly Swerves Into","We and our
partners
store and/or access information on a device, such as cookies and process personal data, such as unique identifiers and standard information sent by a device for personalised ads and content, ad and content measurement, and audience insights, as well as to develop and improve products. With your permission we and our partners may use precise geolocation data and identification through device scanning. You may click to consent to our and our partners’ processing as described above. Alternatively you may click to refuse to consent or access more detailed information and change your preferences before consenting. Please note that some processing of your personal data may not require your consent, but you have a right to object to such processing. Your preferences will apply to this website only. You can change your preferences at any time by returning to this site or visit our privacy policy. By: Josiah Wilmoth | Email | Leave a comment The Dow Jones Industrial Average lurched lower on Monday afternoon, erasing a triple-digit gain and placing its three-day winning streak at risk. The Dow had climbed as high as 26,900.83 during the morning session, leaving the stock market’s bellwether index less than 500 points away from setting a new all-time high. However, the DJIA swerved lower heading into midday, briefly sliding into decline before bouncing back above its previous session close. As of 2:01 pm ET, the Dow had gained 18.55 points or 0.07%. The index last traded at 26,816.01. The S&P 500 and Nasdaq also turned negative – and stayed there – falling 0.11% to 2,975.27 and 0.41% to 8,069.82. There was no clear catalyst for the market’s downward swing, but the Dow’s bull case was not helped by weakness in its most heavily weighted stock: Boeing. The US aerospace giant abruptly halted testing of its 777X aircraft over the weekend, citing an “issue” during the plan’s final load testing. According to the Seattle Times, the 777X test model’s cargo door “exploded outward” during a high-pressure stress test on the ground. The 777X had already been delayed due to issues with its GE-9X engine, forcing it to remain grounded until 2020. With testing now suspended indefinitely, it’s unclear when the 777X will finally enter service. That’s terrible news for Boeing, which continues to suffer from the ongoing 737 MAX scandal. BA shares fell 0.9% to $359.58. Other major Dow stocks reporting significant declines","Sep 9, 2019",https://www.ccn.com/dow-lurches-lower-as-boeing-scandal-takes-explosive-twist/
