,title,headers,text,date,link
12,Why Should 10% of Your Portfolio be Diversified in Bitcoin?,Why Should 10% of Your Portfolio be Diversified in Bitcoin?. What would be the smartest thing for a fast-food company,"As a kid, my weekly Friday routine was a trip to Macdonald’s. I loved it! I still remember the happy meal with hot fries, crispy chicken McNuggets, ice-cold coke, and a surprise toy inside. I remember the yellow & red theme, the clown Ronald Macdonald, and many choices or burgers I could select. It shouldn’t come as a surprise, that I was an unwilling member of my primary school’s Trim And Fit Club (TAF Club). Being in my 30s now, I tend to go Macdonald’s (a lot) less. I think there was a season, where I didn’t visit the fast-food chain for years until an interesting documentary caught my attention. It was called “Super-size me” and follows a 30-day period during which the filmmaker ate only McDonald’s food. He gained about 11kg by the end of the 30 days, telling the world something everyone already knows: “Fast food is bad for you.” Obesity in the United States is viewed as a major health issue. It is believed to result in numerous diseases, specifically increased risk of certain types of cancer, coronary artery disease, type 2 diabetes, stroke, as well as significant increases in early mortality and economic costs. They diversified their products. Macdonald’s started offering healthier options like grilled chicken wraps and cup corn. According to reports, by CNBC and business insider, sale of McMuffins are soaring after a switch from using margarine to butter. Macdonald’s diversifying into more wholesome food offerings, as taste around the world, is getting healthier. Even for myself, when I buy Macdonald’s these days, I often swap my fries for cup corn instead. Most investment professionals agree that, while diversification doesn’t guarantee against losses, it is the most important component to minimise risk and achieve long-term financial goals. Diversification is a method that allocates investments among various financial instruments, industries, and other categories with the agenda of reducing risk and maximizing returns. This is done by investing in areas that would react differently to the same event. Investopedia gives a great example of this. If we have a portfolio of only airline stocks, and it is announced that airline pilots are going on an indefinite strike and that all flights are cancelled, share prices of airline stocks will drop. That means your portfolio will experience a noticeable decline in value. However, when we balance out the airline stocks with some railway stocks, only part of","Nov 8, 2019",https://www.drwealth.com/why-should-10-of-your-portfolio-be-diversified-in-bitcoin/
13,(LEAD) Asiana Airlines shares jump after 3 consortia join final bid for takeover | Yonhap News Agency,". . . (5th LD) Daily virus cases above 1,000 for 4th day, concerns rise over hospital capacity. . .","          (ATTN: UPDATES stock prices; ADDS background in last 5 paras)
By Choi Kyong-ae SEOUL, Nov. 8 (Yonhap) -- The stock prices of Asiana Airlines Inc. and its affiliates advanced Friday after three consortia joined a final auction to acquire the country's second-biggest airline. Asiana shares jumped 9.6 percent to 5,820 won, information and technology solutions provider Asiana IDT Inc. soared by nearly the daily limit of 30 percent to 22,650 won and low-cost carrier Air Busan Co. soared 12 percent to 7,150 won. The broader KOSPI erased earlier gains to end in negative territory, falling 0.3 percent to 2,137.23. On Thursday, the Aekyung-Stone Bridge Capital consortium, the consortium of Hyundai Development Co. (HDC) and Mirae Asset Daewoo, and the consortium of the Korea Corporate Governance Improvement (KCGI) and BankerStreet private equity funds submitted their final bids to Credit Suisse, the sole lead manager of the deal.  Aekyung and HDC reportedly presented the acquisition prices of around 1.5 trillion won (US$1.3 billion) and about 2.5 trillion won, respectively, for the country's second-biggest airline after Korean Air Lines Co. ""News reports that HDC has submitted a price that is far higher than Aekyung's appear to have helped drive up Asiana's and its affiliate's stock prices,"" Mirae Asset Daewoo analyst Park Hee-chul said over the phone. In contrast, HDC plunged 7.3 percent to 31,050 won, and HDC Holdings declined 6.3 percent to 11,850 won. Aekyung Co. also shed 1.8 percent to 29,450 won because of the financial burden facing it. Among the bidders, Aekyung Group has been the most aggressive, stressing it is the only strategic investor that has 13 years of experience and know-how in operating an airline. The cosmetics-to-airline conglomerate said there is no precedent in which a company that does not have experience of operating an airline has succeeded in airline acquisition. As it has Jeju Air Co., the country's biggest low-cost carrier, under its wing, its acquisition of Asiana Airlines is in line with global M&A trends. Kumho Asiana Group, the parent of Asiana Airlines, aims to sell the stake in the airline held by its subsidiary, Kumho Industrial Co., together with its six affiliates as part of its broad restructuring efforts. The six affiliates include two budget carriers -- Air Seoul Inc., which is wholly owned by Asiana Airlines, and Air Busan, which is 46 percent owned by","Nov 8, 2019",https://en.yna.co.kr/view/AEN20191108003651320
14,"Tesla Motors, Inc. (NASDAQ:TSLA) - Musk Vs. Einhorn: Tesla CEO Offers Hedge Fund Manager A Pair Of Short Shorts | Benzinga",. . . . . . . . Musk Vs. Einhorn: Tesla CEO Offers Hedge Fund Manager A Pair Of,"      Tesla Inc
TSLA 5.96%
 CEO Elon Musk on Friday lashed out at Greenlight Capital hedge fund manager and long-time Tesla short seller David Einhorn. In an open letter to Einhorn, Musk alleges Einhorn made “numerous false allegations” concerning Tesla in Greenlight’s third-quarter investor letter. “It is understandable that you wish to save face with your investors, given the losses you suffered from Tesla’s successful third quarter, especially since you’ve had several down years in performance and a sharp drop in assets under management from $15 billion to $5 billion,” Musk wrote in the letter, which he posted on Twitter. We sift through this volatile market for consistent trades so you don't have to. Get Benzinga Options: Starter Edition to follow Benzinga's high-conviction options trades.  Click here to get my trades! Musk’s tweet comes in response to Einhorn’s letter released earlier this week in which he referenced an ongoing lawsuit against Musk by Tesla shareholders who claim he failed to fully disclose a “liquidity crisis” at SolarCity prior to Tesla’s 2016 buyout of the solar company. “To the surprise of nobody, documents in TSLA’s SolarCity litigation unsealed in September showed that Elon Musk knowingly orchestrated a significant fraud by arranging the $2.6 billion acquisition at a time when SolarCity was insolvent,” Einhorn wrote in his letter. “For now, the accepted reality appears to be that Elon Musk is above the law.” Tesla shares are up more than 40% in the past month after the company reported its first quarterly profit of 2019 in the third quarter. pic.twitter.com/w0BkNGbvQ1 — Elon Musk (@elonmusk) November 8, 2019 “Please allow us to send you a small gift of short shorts to help you through this difficult time,” Musk wrote on Friday. Following the recent rally, Tesla shares have nearly recovered all of their late 2018 and early 2019 losses and are now down just 3.8% overall in the past year. Einhorn’s struggles have been well-documented in recent years, as fund managers that rely heavily on traditional value investing strategies continue to underperform. However, Musk’s repeated taunting of short sellers will likely embolden critics who have referred to him as immature and bratty. Tesla's stock traded around $335 per share at time of publication. Do you agree with this take? Email feedback@benzinga.com with your thoughts. Related Links: Whitney Tilson Loses Tesla Bet, Will Donate $15K To Charities Tesla Short Sellers","Nov 8, 2019",https://www.benzinga.com/news/19/11/14771177/musk-vs-einhorn-tesla-ceo-offers-hedge-fund-manager-a-pair-of-short-shorts
15,How can zero-dollar commissions be successful? | The Seattle Times,How can zero-dollar commissions be successful?. Most Read Business Stories. . . . . . . . . . ,"Ask the Fool Free Trading Commissions Q: My brokerage has just announced that online stock trades will now cost $0. Is that sustainable? — H.R., Pawtucket, Rhode Island A: It certainly can be. Once a brokerage has its trading technology set up, it doesn’t cost a lot to execute trades. Keep in mind, too, that trading commissions are not the brokerage’s only source of income. Like banks, brokerages get a lot of money from “net interest” — the difference in the interest rate they pay customers for cash deposits and the interest rate they earn when they invest customers’ cash. They also collect interest when investors borrow funds with which to buy stocks (“on margin”). Many brokerages these days are also generating income via asset management — offering research and advice to customers. Then there are fees: These include fees for “account maintenance,” paper statements, inactivity or when you buy or sell mutual funds. There’s also income to be collected from the difference, or “spread,” between a stock’s “bid” price (what an investor is willing to buy the stock for) and “ask” price (what a seller is willing to sell it for). Q: Are Social Security benefits going up much in 2020? — C.L., Portland, Oregon A: The cost of living adjustment (COLA) for Social Security in 2020 is 1.6%, considerably lower than 2019’s 2.8% increase. With the average monthly retirement benefits check recently at $1,475, a 1.6% increase will mean $23.60 more per month, or about $283 more annually. It’s not a lot, but in retirement, every little bit can help. You can learn more about Social Security and how you may be able to increase your benefits by searching for the terms “Social Security” and “Motley Fool” in Google.  My Dumbest Investment Pumped and Dumped My dumbest investment was buying a pump-and-dump pharmaceutical stock when it was in full “pump” mode. Seemed like a good idea at the time — ha! — T.N., online The Fool responds: You fell for a classic kind of stock market con. It’s typically penny stocks (those trading for less than about $5 per share) that are involved in pump-and-dump schemes, because they have relatively few shares available for trading, and they’re easy to manipulate. Here’s how the schemes work: A con artist buys a bunch of shares of a certain stock and then starts hyping it — online or via email,","Nov 9, 2019",https://www.seattletimes.com/business/how-can-0-commissions-be-successful/
16,"Have no interest in Air India, only IndiGo: Qatar Airways CEO Akbar Al Baker - The Financial Express","Have no interest in Air India, only IndiGo: Qatar Airways CEO Akbar Al Baker. “We have no interest in buying","Qatar Airways on Thursday ruled out participation in the sale of national carrier Air India. However, the airline’s chief executive officer (CEO) Akbar Al Baker said it can look to invest in budget carrier IndiGo at an appropriate time. “We have no interest in buying stake in Air India. We are interested in buying stake in IndiGo, but this is not the right time as issues among promoters are yet to be resolved,” Baker told reporters. In the past, Baker has expressed interest in picking up stakes in an Indian carrier and setting up a domestic airline in the country. Meanwhile, IndiGo and Qatar Airways have signed a one-way codeshare agreement giving the middle-eastern carrier further access into the Indian market. The codeshare pact will enable Qatar Airways to place its code on IndiGo flights between Doha and Delhi, Mumbai and Hyderabad. It means that Qatar Airways can now sell IndiGo tickets for onward journey from these three cities. IndiGo CEO Ronojoy Dutta said that both carriers were working on a reciprocal agreement which would be announced soon. This is the second codeshare agreement for IndiGo as part of its growth strategy for international markets; it signed a two-way codeshare agreement with Turkish Airlines in December last year. Qatar Airways has been looking to increase its presence in one of the fastest growing aviation markets in the world. The full-service carrier has been urging the government to increase the bilateral flying rights between Qatar and India. Under the current bilaterals, both countries have a quota of 24,292 weekly seats each. According to the ministry of civil aviation, the Qatari side has exhausted its quota utilising 24,655 seats with 102 weekly flights between Doha and 13 destinations in India, including Ahmedabad, Bengaluru, Chennai, Delhi, Goa, Kolkata, Mumbai and Thiruvananthapuram. On the other hand, the Indian carriers are using around 12,000 seats per week to Qatar.  Subscribe to Financial Express' weekly SME newsletter for latest and all-round coverage from the world of the biggest business in India - the Micro, Small and Medium Business. Get live Stock Prices from BSE, NSE, US Market and latest NAV, portfolio of Mutual Funds, calculate your tax by Income Tax Calculator, know market’s Top Gainers, Top Losers & Best Equity Funds. Like us on Facebook and follow us on Twitter. Financial Express is now on Telegram. Click here to join our channel and stay updated","Nov 8, 2019",https://www.financialexpress.com/industry/have-no-interest-in-air-india-only-indigo-qatar-airways-ceo-akbar-al-baker/1758025/
