,title,headers,text,date,link
12,Will Zurich's bid for Jewar airport challenge IGIA's monopoly? | Business Standard News,". Will Zurich's bid for Jewar airport challenge IGIA's monopoly?. If the project is completed on time, Jewar airport -","By continuing to use this site you consent to the use of cookies on your device as described in our Cookie Policy unless you have disabled them. You can change your Cookie Settings at any time but parts of our site will not function correctly without them. Topics
zurich | Indira Gandhi International Airport | Jewar airport Arindam Majumder  |  New Delhi 
Last Updated at December 1, 2019 00:35 IST STOCK PRICE - CLICK HERE FOR MORE BSE 26.85-0.65 (-2.36%) NSE 26.85-0.65 (-2.36%) Flughafen Zurich winning the bid for the proposed Jewar airport in Uttar Pradesh is likely to bring a paradigm change to India’s airport sector, threatening monopolies for the first time, said sector experts. If the project is completed on time, Jewar airport — projected as the second such facility for the National Capital Region — will compete with GMR-owned Indira Gandhi International Airport (IGIA) from 2023 to attract air traffic. This could be a threat to IGIA’s monopoly on air traffic in north India, which has made it the crown jewel in GMR Infrastructure’s airport portfolio. Zurich Airport offered a revenue share of Rs 400.97 per passenger. GMR, which had the right of first refusal (RoFR), offered Rs 351 per passenger. It would have had the chance to match the highest bid only if its offer was within 10 per cent of it. “GMR’s bid was aggressive and rightly so, as they were desperate to win it because of a lot of synergy it offers with IGIA. That Zurich was able to outbid GMR, which had a RoFR, is something extraordinary. It doesn’t happen every day,” said an executive of a financial institution which invests in infrastructure projects. Jewar is about 80 km from IGIA. A six-year-long moratorium over concession fees to be paid to the government may give a buffer to Zurich. But, in the long term, completion of the project on time will determine its ability to compete with Delhi, said experts. “The winning bid marks the re-entry of Zurich Airport in India. What is defining is the entry of an experienced player in a market that has GMR, GVK, Fairfax, and Adani. Their bidding number underscores their understanding of the Indian market and how important they think it is,” said Sidharath Kapur, former executive director at GMR Airports. Capacity crunch in Delhi and Zurich’s ability to offer better services may make Jewar airport","Dec 1, 2019",https://www.business-standard.com/article/companies/will-zurich-s-bid-for-jewar-airport-challenge-igia-s-monopoly-119113000880_1.html
13,WB news - webe.news,,"Sort by website: all | General | Finance | Humanities | Business & technology | Science | Health & live science | World | Life & style
Sort by importance: all | General | Finance | Humanities | Business & technology | Science | Health & live science | World | Life & style
Sort by time: all | General | Finance | Humanities | Business & technology | Science | Health & live science | World | Life & style more category:
Magazines & media  Encyclopedia & knowledge base  Search Engines  Math  Dictionaries & translation tools  IT & computing  Learning resources  English study  Visual arts & design  News aggregation  Natural & alternative therapies  Food & nutrition ","Dec 1, 2019",http://www.webe.news/index.php?&&lc=0&&cc=108130000&&pn=25&&wl=en&&ob=&&tr=66199&&vl=&&vlog=&&&&pn=29&&tr=66199&&
14,Nissan’s New CEO Takes Over With Long List of Problems to Fix - BNN Bloomberg,. BNN. BLOOMBERG NEWS WIRE. . Azar Boosts SPAC IPO Size to $300M. . NEWS WIRE. Company News. Investing. Nissan’s,"    Latest From Bloomberg  U.S. Envoy Abrams Sees New Iran Sanctions, Rules Out Military Action Notion of Iran Military Strike Is 'Garbage,' Says U.S. Envoy Abrams Trump Wins Battleground State of Texas   Dec 1, 2019  Reed Stevenson, Bloomberg News Ashwani Gupta Photographer: Toru Hanai/Bloomberg , Bloomberg (Bloomberg) -- Only once before has a leader of Nissan Motor Co. inherited challenges as monumental as those confronting Makoto Uchida, who is starting his first week as chief executive officer. The last time Nissan faced an existential crisis was two decades ago, when it was on the verg 7e of bankruptcy and was rescued by Renault SA, which took a stake in the Japanese carmaker and sent in Carlos Ghosn to turn it around. Ghosn later added Mitsubishi Motors Corp. to the pact, which became the world’s biggest carmaking alliance under the former chairman and CEO. Once again, Nissan needs to get its business in order. And fast. Ghosn’s arrest a year ago on charges of financial crimes unleashed corporate infighting, and damaged Nissan’s relations with Renault. Profits are at decade lows, 12,500 jobs will be cut and there are few new models to refresh an aging product lineup. Autonomous vehicles and electrification are poised to disrupt the industry in a once-in-a-generation shift. “It’s not realistic to expect a miraculous V-shaped recovery, but it is important to show that it can be done,” Bloomberg Intelligence analyst Tatsuo Yoshida said. “Externally, Uchida needs to normalize the relationship with Renault and restore trust in Nissan. Internally, he needs to address the gulf that’s opened up between employees and management.” Uchida, who most recently ran Nissan’s joint venture in China, is scheduled to hold his first news conference as CEO later on Monday at Nissan’s Yokohama headquarters. The 53-year-old formally took over Dec. 1. Nissan overhauled top management a month ago, adopting a collective-style leadership aimed at moving past the outsized influence Ghosn had over Nissan and the alliance with top shareholder Renault. Ashwani Gupta was appointed chief operating officer, and Jun Seki as deputy COO. The son of an airline employee, Uchida lived abroad in several countries including Egypt while growing up. He studied theology at Japan’s Doshisha University, an unusual background for a car executive. Unlike Ghosn, he’s seen as a quiet, straightforward manager used to delegating power, people with knowledge of the matter have said. Restoring","Dec 1, 2019",http://www.bnnbloomberg.ca/nissan-s-new-ceo-takes-over-with-long-list-of-problems-to-fix-1.1355864
15,Top chefs pick favourite cities around the world for great restaurants - BNN Bloomberg,. BNN. PURSUITS. PURSUITS. Top chefs pick favourite cities around the world for great restaurants. Pursuits. ,"    Nov 30, 2019  Richard Vines, Bloomberg News Francesco Mazzei. Bloomberg/Jason Alden , Bloomberg Everyone knows you can enjoy wonderful meals in cities such as Paris, New York, London and Tokyo. But what of other dining destinations, with fabulous dishes that are more likely to be found in casual bars or bistros than in fancy restaurants? We asked some of the world’s leading chefs about their favourite food cities, from the markets of Ghana in West Africa through the crowded and noisy streets of Kolkata to a tiny island off Auckland, in New Zealand. Here are their recommendations. Buenos Aires, Argentina Mauro Colagreco is the holder of the title of World’s Best Restaurant at Mirazur, in the south of France. But he still misses the food of his native Argentina.  “The country and cuisine are both incredibly close to my heart,” he says. “I often return to La Plata and Buenos Aires to see family and spend time there. In Buenos Aires, I always recommend Parrilla Don Julio, it offers the best Argentinian meat cooked with unparalleled expertise. For brunch or a relaxed lunch, Narda Comedor is comfort food with fresh ingredients.” Melbourne, Australia British-born Ashley Palmer-Watts is the executive chef of Dinner by Heston Blumenthal in London and Melbourne, where he has fallen in love with the dining scene. “Melbourne is great because of the range of types of restaurants,” he says. “They are just so approachable, with good tasty food. My go-to restaurants are Cutler & Co. and MoVida. I love sitting at the bar. Also Marion wine bar, which is run by Andrew McConnell of Cutler. You can have great food, great wine, great service. It is just so easy and diverse.” Accra, Ghana “There is amazing street food in Accra,” says chef Selassie Atadika, where she celebrates Africa’s culinary heritage at Midunu. “There is everything from bofrot (donuts) and hausa koko (spiced millet porridge) and waakye  (rice and beans) to afternoon snacks of fried yam  stick with shito (preserved chili sauce with dried shrimp). Then there is kenkey (fermented corn) in the Osu night market and an ice-cold akpeteshie (a spirit made from palm wine or sugar cane juice) cocktail with live music at the Republic bar.” Kolkata, India Chef Asma Khan of Darjeeling Express in London savours the food of her native Kolkata, or Calcutta as it was","Nov 30, 2019",http://www.bnnbloomberg.ca/top-chefs-pick-favorite-cities-around-the-world-for-great-restaurants-1.1355483
16,Stocks tumble on jitters over US stand on Hong Kong issue | Philstar.com,SIGN UP TO RECEIVE OUR EMAIL,"MANILA, Philippines — A new development that could further fuel tensions between the US and China sent the stock market crashing yesterday. The Philippine Stock Exchange index tumbled for a second consecutive session to close the week on a sour note, dropping 0.38 percent or 29.70 points to close at 7,738.96. The broader All Shares index was likewise in the red, dropping 0.38 percent or 18.11 points to finish at 4,632.84. “Philippines shares along with US stock futures tumbled on Thanksgiving after US President Donald Trump signed into law a controversial bill backing Hong Kong protestors,” Regina Capital’s Luis Limlingan said. Limlingan said the move can potentially add strain to the US’ current trade relationship with China. The Hong Kong issue likewise left other regional markets reeling as they also closed in the negative territory. In the local market, only two gauges managed to end on a positive note. These were the property and services, which rose 0.43 percent and 0.08 percent, respectively. The rest were in the red, led by the mining and oil counter as well as financials which plunged 1.89 percent and 1.59 percent, respectively. Value turnover stood at P6.37 billion. Market breadth was negative as decliners pummeled advancers, 125 to 63, while 48 stocks did not change.  The most important news of the day
about the Philippines and the world in one email Advertisement Advertisement ","Nov 30, 2019",https://www.philstar.com/business/2019/11/30/1972913/stocks-tumble-jitters-over-us-stand-hong-kong-issue
17,I opened a high-yield savings account to pay for my wedding - Business Insider,". I opened a high-yield savings account to pay for my wedding the week I got engaged, and liked it","  When my now-husband asked me where I wanted to go on our first date I remember saying, ""I don't care, as long as it's cheap. I'm on a budget."" Six years later he asked me to marry him, and I opened up our first shared bank account that week so we could start saving for our wedding. Money has been a constant source of conversation throughout our relationship — not because we're overly fixated on it, but because we've always been open and honest about the way money touches our lives, both separately and together. When we started dating, money affected how much money we felt comfortable spending on going out. When we moved in together, it affected where we could afford to apartment hunt and how we were going to share our newly joint living costs. When we faced challenges, like my medical bills not covered by insurance and his apartment getting broken into, money became a safety net. It's not that money affected us any more or less than anyone else, it was just something we talked about a lot more than anyone else. And when we got engaged was no different. I immediately started thinking through logistics — mapping out all of the major goals we had for the next five years and the estimated amount of money needed to afford them. We started putting a plan of action in place by opening our first shared bank account — a high-yield online savings account. Well, for starters, our biggest and most near-term financial goal post-engagement was to pay for our wedding — so a savings account dedicated to funding the milestone seemed like a natural place to start joining our finances. To maximize our money with higher interest rates without locking it up in a CD or risking it in investment accounts, we opted for high-yield online savings. We agreed we would each contribute a lump sum that we'd already had in our individual savings to get the account funded. When choosing our first shared savings account, we had a few criteria: High interest rates According to the FDIC, the national average interest rate on savings is just 0.09% APY. Many traditional brick-and-mortar banks offer even less on their savings accounts. So we decided to explore online-only savings accounts which typically offer higher rates. When we opened our joint savings account we were getting 2.0%","Nov 30, 2019",https://www.businessinsider.com/personal-finance/high-yield-savings-account-pay-for-wedding-combine-finances
18,BYU-Idaho student dies Archives - BYU-I Scroll,BYU-Idaho student dies. BYU-Idaho student dies with eight other family members in plane crash,,"Dec 1, 2019",https://byuiscroll.org/tag/byu-idaho-student-dies/
