,title,headers,text,date,link
10,The Top 10 Stocks of the Past Decade | Kiplinger,Save up to 67%. The Top 10 Stocks of the Past Decade. One thing nearly everyone can agree on about,"Getty Images One thing nearly everyone can agree on about the past decade is that it has been very, very good for stock market investors. The Russell 1000 large-company index, which tracks the 1,000 biggest U.S. stocks by market value, has gained roughly 252% since the start of the 2010s, including reinvested dividends. Some stocks have done far better. Microsoft (MSFT) awoke from its long slumber and jumped 545% over the past decade. Dollar General (DG) made a lot of bucks, gaining 632%. And Ulta Beauty (ULTA) has made a lovely 1,325% gain. But those aren't the tippy-top stocks of the Russell 1000. Not even close. Here are the top 10 large-company stocks of the decade, as well as a look at what put them on top of the heap. We chose the Russell 1000 because it offers an even broader look at the stock market than the S&P 500, but still excludes smaller companies where extremely outsize gains are more common and can more easily come from a single, quick driver. 1 of 10 Getty Images Pumps and valves are not exactly the most high-tech gadgets around – but they can be, if you put them on commercial and military aircraft. In Transdigm's fiscal 2019 ended Sept. 30, the company sold about $5.2 billion worth of those components. When you consider that the company did about $828 million in revenues in fiscal 2010, you start to get an idea of what propelled TransDigm into the ranks of the decade's top stocks. In 2019, TDG has delivered a 77.6% total return, thanks in part to decent organic growth as well as bolt-on gains from the acquisition of manufacturer Esterline. Shareholders also benefited from a $30-per-share special dividend – it's among a handful of stocks that have paid several special dividends in recent years. From here? At 27.6 times forward-looking estimates for next year's earnings, TransDigm's stock isn't cheap, but it's not in the stratosphere, either. 2 of 10 Getty Images Cheniere made this list of top stocks because timing is everything, especially when it comes to energy stocks. Had you bought the stock 15 years ago, your average annual return would have been 4.4%; if you had bought five years ago, you would have lost an average 1.2%, thanks to swings in energy prices. A decade ago, the economy was barely crawling. Today, the economy is booming. And should U.S.-Chinese","Dec 18, 2019",https://www.kiplinger.com/slideshow/investing/t052-s001-the-top-10-stocks-of-the-past-decade/index.html
11,Jet Airways: Two more interested in boarding stressed airline - The Financial Express,"Jet Airways: Two more interested in boarding stressed airline. Two more entities have expressed early interest in Jet Airways, the","By Anwesha Ganguly Two more entities have expressed early interest in Jet Airways, the company’s resolution professional, Ashish Chhawchharia, told the National Company Law Tribunal (NCLT) on Tuesday. The Committee of Creditors (CoC) of Jet Airways on Tuesday in-principle agreed to formally call for fresh expressions-of-interest. So far, the Colombian Synergy Group was the only one in talks to revive the grounded airline. “The group’s draft business plan is not compliant with the Corporate Insolvency Resolution Process. We will need a final resolution plan and further commitments from Synergy Group. Their interest is conditional on assurance on Heathrow, Amsterdam and India slots, which the CoC cannot give. The two other parties only expressed their interest two days ago. Instead of extending the time period just for this one group, the CoC decided to call for fresh bids. Final decision is expected by Saturday,” a person aware of the developments said. The Synergy Group will now have to put in a fresh EoI during the next round. Among the two new players, one is an Indian entity backed by a UK-based investor and the other is a fund based in West Asia, the person said. Meanwhile, senior officials of ministry of civil aviation (MoCA) and Directorate General of Civil Aviation (DGCA) told the tribunal that the government will “positively consider” any business plan for Jet Airways. “If slots are not used, they are perishable and the public gets inconvenienced. Whenever they (Synergy Group) give a confirmed plan, certainly we are open to examining that,” Usha Padhee, joint secretary, MoCA, told NCLT. Representatives from Colombian Synergy Group, which has been in talks with the lenders to invest in the grounded airline, will meet the two-member bench of the Mumbai NCLT on Thursday. The bench had sought the group’s appearance before court to assess its seriousness about bidding of Jet Airways. Most of Jet’s erstwhile domestic slots have been re-allocated to other carriers till March 2020 after the airline was grounded eight months ago. Some of them have been allotted to Air India till October 2020. The RP on Tuesday told the bench that Synergy Group last week presented a draft business plan. The CoC also discussed giving more time to the Synergy Group to firm up their plans. FE had earlier reported that the group wanted further clarity on Jet’s erstwhile slots, specifically those in the London Heathrow Airport, before finalising its","Dec 18, 2019",https://www.financialexpress.com/industry/jet-airways-two-more-interested-in-boarding-stressed-airline/1797125/
12,Burkett Huey | Morningstar,Burkett Huey. Latest. Boeing's 737 MAX Can Return to Service in the U.S.. Boeing Progress Toward 737 MAX Return to,"Burkett Huey is an equity analyst on the industrials team for Morningstar. © Copyright 2020 Morningstar, Inc. All rights reserved. Dow Jones Industrial Average, S&P 500, Nasdaq, and Morningstar Index (Market Barometer) quotes are real-time.
This site is protected by reCAPTCHA and the Google Privacy Policy and Terms of Service apply. Terms and Conditions
Privacy Policy
Disclosures
Member User Agreement
Corrections
Cookies","Dec 18, 2019",https://www.morningstar.com/authors/2229/burkett-huey
13,IAG ready to take off -  Investors' Chronicle,IAG ready to take off. IAG's Air Europa bid could provide a major boost to its positive story. IAG:LSE. .,"When International Consolidated Airlines (IAG) was formed in 2011, bringing together national carriers British Airways and Iberia, consolidation was an idea at the heart of the venture. This November, the company announced a major deal to buy Air Europa, which, if approved by regulators, could provide a major boost. Meanwhile, tough trading during 2019 has seen the industry rein in its growth plans, which should help underpin ticket prices. Add this to the track record established by IAG since its creation and an unchallenging valuation, and we think it is time to switch tack on the shares and change our recommendation from sell to buy. Air Europa acquisition Reduced industry capacity growth Norwegian Shuttle route cancellation Cost-cutting Recent tough trading Stikes not officially resolved The acquisition of Air Europa, costing €2.4bn including debt, would make IAG the market-leading airline serving the South Atlantic from Europe. If cleared, the deal would be expected to complete in the second half of 2020. As well as gaining lucrative routes from the acquisition, based on past experience investors should be able to expect major cost savings. Indeed, Europa would be the fifth acquisition for IAG since its formation, which includes the purchase of assets from Monarch after its administration.   International Consolidated Airlines Group SA  IAG’s solid financial position means it can fund the deal with borrowings, while keeping net debt/cash profits (Ebitda) some way below its 1.8 times target. Importantly, IAG’s structure lends itself to consolidation. Its four airlines – British Airways, Iberia, Aer Lingus and Vueling – operate independently, but share central functions. Meanwhile, capital allocation decisions are made at group level. This has served IAG shareholders well since 2011 as measured by growth in return on invested capital (ROIC), with the group’s target to maintain ROIC at an industry-leading 15 per cent or more.  Part of IAG’s success in raising ROIC has been thanks to its ability to cut costs. Between 2010 and 2018, cost per average seat kilometre, excluding fuel, has fallen 10.7 per cent and further reductions of 1 per cent a year are targeted in the three years to 2022. IAG thinks it can unlock another level of synergies by performing more core airline activities at the group level, including loyalty schemes, fleet management, sales and pricing.  The competitive environment also appears to be becoming more favourable due to falling airline capacity growth. The","Dec 18, 2019",https://www.investorschronicle.co.uk/tips-ideas/2019/12/18/iag-ready-for-tailwind/
14,British Airways Third Worst Airline Flying To/From UK - LoyaltyLobby,British Airways Third Worst Airline Flying To/From UK. YOU MIGHT ALSO LIKE. RELATED ARTICLESMORE FROM AUTHOR. British Airways Has Been,"Which? today released their annual airline survey. British Airways and Vueling, both owned by IAG, were third and second-worst airlines flying to/from the UK. Only the Ryanair was ranked lower.  This shouldn’t come as a surprise to anyone considering how even the LCC’s provide better overall experience considering the price paid than the former flag carrier of the UK. Here are the ratings:  Here’s the press release from Which: Once self-proclaimed ‘the world’s favourite airline’, British Airways has this year found itself grounded alongside repeat offenders, Ryanair and American Airlines, as one of the nation’s worst airlines, according to the Which? Travel annual airline survey. Holidaymakers panned BA for the quality of its food and drink, the comfort of its seats and value for money for its short-haul and long haul services with both only managing a 55 per cent customer score overall. The consumer champion asked more than 6,500 holidaymakers to rate their experiences of flights taken over the course of 12 months. Passengers were asked to describe their experiences of customer service, boarding and cabin environment. Once-loved British Airways was the third from the bottom of the short-haul table and fared even worse when it came to its long haul offering where it was second from the bottom. The British flag carrier was awarded the best short-haul airline in the Which? Travel survey in 2015 but subsequent IT failures, strikes and mass cancellations have contributed to the descent of the airline in customers’ estimations. Some passengers had such bad experiences they told Which? they would never fly British Airways again with one going as far as to say “BA is, without doubt, the worst airline we’ve ever used.” Ryanair was voted the worst short-haul airline, a dubious accolade which it has flirted with for the last four consecutive years, with a dismal score of only 44 per cent. Many passengers who had flown with the budget carrier pointed out the endless add ons and the finicky luggage requirements with one saying customers were treated like ‘cash cows’ and another carried on the analogy by saying the airline had a ‘cattle class mentality’. Customers gave the airline the lowest possible score of one star out of a possible five in all categories including boarding, customer service and cabin experience, apart from value for money where it managed a two-star rating. Vueling Airlines (54%) and Wizz Air (56%)","Dec 19, 2019",https://loyaltylobby.com/2019/12/19/british-airways-third-worst-airlines-flying-to-from-uk/
15,Investor Overview | SCI,Investor Overview. Who we are. SCI Third Quarter 2020 Earnings Call. ABOUT US. CAREERS. INVESTORS. PARTNER WITH US. MEDIA," Service Corporation International (SCI) is North America’s largest provider of funeral and cemetery services, with shares traded on the New York Stock Exchange under the symbol SCI.  The Company was founded in 1962 and is headquartered in Houston, Texas.  We currently own and operate more than 1,900 funeral homes and cemeteries in 44 states, eight Canadian provinces, the District of Columbia and Puerto Rico. See our latest financial results, dividend declarations, share repurchase authorizations and other announcements.  READ MORE See our latest annual and quarterly filings, proxy statements, current reports and other documents. READ MORE See upcoming events, listen to quarterly earnings calls and investor conference webcasts, and view Non-GAAP and other related presentations. READ MORE Learn about our commitment to conducting all aspects of our business with the highest ethical standards.  READ MORE See our current stock performance, historical stock prices, splits and dividends, and analyst coverage. READ MORE See what our CEO and Board say about our Company's performance, compensation highlights, Board composition and important voting matters in our 2019 Proxy Statement. READ MORE LEARN MORE  ","Dec 18, 2019",https://investors.sci-corp.com/
16,Martin Pring: Commodity prices about to bottom out:  Martin J. Pring - The Economic Times Video | ET Now,. . . . . . . . . . . Commodity prices about to bottom out: Martin J. Pring.,"    Martin J. Pring, founder of Pring Research and author of 20 books on technical analysis, shares his thoughts on liquidity-flooded markets, inter-market relationships and his own prediction of a bear market in the United States in 2020. Pring is in conversation with ETMarkets.com editor Bijoy Sankar Saikia on the sidelines of the CMT India Summit in Mumbai. Tune in.     Trending Now Popular Categories Hot On Web In Case You Missed It ET Verticals More From Our Network Other Useful Links Services    ","Dec 18, 2019",https://m.economictimes.com/markets/stocks/news/commodity-prices-about-to-bottom-out-martin-j-pring/videoshow/72869750.cms
17,Boeing Made These Shrewd Moves to Fend off Investor Revolt. Will it Last? | Fortune,Boeing Made These Shrewd Moves to Fend off Investor Revolt. Will it Last?. Business reality. Signaling confidence. Call for the,"December 18, 2019 2:28 PM GMT+2      Tuesday should have been the worst of all days for Boeing. The day before, the company announced that it would halt production of its fast-selling but troubled aircraft, the 737 MAX next month.  Then, Tuesday morning, Boeing said it had no plans to lay anyone off because of the stoppage, and that yes, dear shareholders, it would continue to pay out its dividend. Had corporate management gone loopy? Announcing a quarterly dividend payment worth about $1.2 billion and, the morning after, ruling out layoffs following a production halt on its star product—a decision that led major customer Southwest Airlines to delay the MAX's debut on its flight schedule from March 6 to April 13, 2020—would normally be the kind of behavior that would set investors' heads spinning with doubts. But ultimately the market didn't blink. Since the Lion Air and Ethiopian Airlines 737 MAX crashes that killed 346 people and led to the grounding of the airplane in March, Boeing's stock trajectory has resembled something like a flight rocked by violent mid-air turbulence—dropping from a high of $440.62 in February to a low near $320 in August. On Tuesday, Boeing's global suppliers saw their shares take a hit, with General Electric, which makes the MAX engines, falling 0.63%. But Boeing's own shares ended the day flat at $327, recovering from an early sell-off. The question, then, is why the market didn't punish the Chicago-based planemaker on such a traumatic day. The answer: steady moves and positioning on Boeing's part, and the bottom-line realities of its business. First, the bigger reality. No ifs, ands, or buts. The company has taken a big hit over the MAX, and the decision to stop making the plane—however long the hiatus lasts—is serious. ""For them to halt production means there are sales that are permanently lost,"" says James Angel, professor of finance at the McDonough School of Business at Georgetown University. But while virtually all the talk about the company these days focuses on the MAX, Boeing is more than this one product line. Boeing has three separate divisions: commercial airlines; defense, space, and security; and global services—and the two business segments that don't involve the 737 MAX grew year-over-year. The table below shows the revenues for each in the first nine months of both 2018 and 2019. In addition, Boeing's problems with","Dec 18, 2019",https://fortune.com/2019/12/18/boeing-max-dividends-investor-revolt/
