,title,headers,text,date,link
12,10 Best ETFs for 2020: The Competition Is Stacked Full of Potential | InvestorPlace,10 Best ETFs for 2020: The Competition Is Stacked Full of Potential. Many of these funds stand a chance at," The continuation of the trade war between China and the United States, as well as concerns of a yield curve inversion, all led to a dramatic conclusion to 2018 and a questionable start to 2019. As such, many stocks and exchange-traded funds began the year in the red. But despite this rough start, the “doomsome” outlook dissipated and the S&P 500 ultimately gained another 30% on the year. Throughout the year, several InvestorPlace.com writers chose what they thought might be the best ETFs for 2019. And while some of these ETFs ended up being duds (several picks were affected by the trade war), the top 5 picks all gained more than 25% year to date. This year, we have 10 more picks for the contest, some new challengers for the best ETF throne, a returning champion (Vince Martin) and some other familiar faces. But all of the ETFs for 2020 are different from last year’s picks. And the arguments behind some are perhaps far more daring than before. With trade war tensions easing, marijuana stocks losing strength and general market optimism rising, what should we expect in 2020? And might the 2020 election throw a huge wrench into things? Regardless of what happens, each fund in the best ETFs contest this year reflects the core reason why someone might choose an ETF over a single stock investment. Specifically, each fund focuses on a centralized theme that enables access to numerous companies related to that core concept. If you’re a big believer in the future of a big idea, potential catalyst or think you know where the market will go — good or bad — then owning shares of multiple companies related to that market thesis through an ETF can be highly profitable. The best ETFs contest will start with the closing prices of each fund on Dec. 31, 2019, and assess their performance for the year from that day forward. Throughout the year, we will provide quarterly updates on the performance of each fund, until a winner is crowned at the end of 2020. Note that dividends will not be factored into the performance assessment for each ETF. With out further ado, in alphabetical order by ticker, InvestorPlace.com’s best ETFs for 2020 are: 15 TECH STOCKS SET TO CASH IN ON THE 5G REVOLUTION  Investor: InvestorPlace Staff
Expense Ratio: 0.99%, or $99 annually per $10,000 invested First on this","Dec 26, 2019",https://investorplace.com/2019/12/10-best-etfs-for-2020-the-competition-is-stacked-full-of-potential/
13,Passive Funds: Leaving Active Managers Red-Faced – Wealthface,. . . . . Five Reasons to Get Your Mates On-Board with Wealthface. How to Retire at 50 and,"  Fund managers, economists and investment experts love nothing more than a heated debate. After all, each of them take their approach to investing and building wealth very seriously, and it only makes sense that they strongly believe their own way of doing things is best. For the past couple of years, the biggest disagreements in […] Fund managers, economists and investment experts love nothing more than a heated debate. After all, each of them take their approach to investing and building wealth very seriously, and it only makes sense that they strongly believe their own way of doing things is best. For the past couple of years, the biggest disagreements in the world of wealth management have been between those fund managers who prefer an active approach, and those who are opting for the increasingly far more popular and effective passive option (as heralded by Nobel Prize-winning whizz Harry Markowitz). While the active fund managers certain have plenty of passion history behind their arguments, those on the passive investing side are clearly onto something; over a billion dollars has been moved from active stock funds into passive ones in the past decade,  and that kind of economic exodus doesn’t come about for no reason. It’s no coincidence that this rush of interest into passive funds arose with the advent of robo-advisors – an approach fully embraced by passive fund managers for their trustworthiness and unrivalled accuracy. Investment journals and studies since 2007 have repeatedly dealt some pretty major blows to active stock funds, with all kinds of revelations gradually chipping away at the confidence of active stock fund managers. The Wall Street Journal itself has proclaimed that no less than 82% of active funds in the US have seriously trailed behind in the 15 years, and similarly game-changing statistics have flooded out of other countries, too. It seems that the active model has lost some of its sparkle, and is struggling to convince investors of its merits in the 21st century. On the flipside, the passive fund’s star continues to rise year on year, with innovation, accuracy and low-cost fees leading the way. It was the timescale of this Wall Street Journal study that seemed to send real shockwaves through the investment industry. Fifteen years is a long time in the world of investing. The study was able to demonstrate such a downwards trajectory, despite the various","Dec 27, 2019",https://wealthface.com/blog/passive-funds-leaving-active-managers-red-faced/
14,"4-year high: Airlines’ April-Nov losses at ₹6,845 cr - The Hindu BusinessLine",". Logistics. 4-year high: Airlines’ April-Nov losses at ₹6,845 cr. . . . . SHARE. Recommended for you. Senior care"," MORE Impacted by myriad factors ranging from high fuel costs to economic slowdown, the Indian aviation sector has recorded operating losses of ₹6,845.78 crore during the first eight months of this financial year, its highest since FY15. For April-November, the private carriers’ losses rose to ₹2,311.79 crore, while that of the national carrier (and subsidiaries) were at ₹4,533.9 crore in the full financial year of FY2019. According to industry experts, things are unlikely to change for the rest of the year. For April-November, state-run carriers posted the highest losses, with Air India’s losses zooming to ₹4,685 crore, as against a loss of ₹1,658 crore recorded in FY2019. Air India’s subsidiary Alliance Air, which generally operates on UDAN routes, posted ₹308 crore in losses (₹134 crore loss in FY19), according to Ministry of Civil Aviation (MOCA) data. Among all the three government-owned carriers, Air India Express is the only profitable one. Even though, there has been a dip in profits, the airline has posted an operating profit of ₹459 crore (₹547 crore). During the reporting eight-month period of FY20, the total operating revenue of Indian carriers stood at ₹81,164 crore (₹92,145 crore). “The Indian aviation industry is hemorrhaging due to several changes in FY20. The growth in passenger demand in the 2019 has been below expectations and the current economic slowdown in India has complicated matters further. The grounding of Boeing 737 MAX, the Pratt & Whitney engine issues faced by IndiGo and the precarious state of Air India are the key obstacles,” Abhilash Varkey Abraham, Research Analyst, Aerospace & Defense, Frost & Sullivan Amongst the private carriers, Tata SIA Airlines (operating as Vistara) posted the highest losses of ₹900 crore during the eight-month period. Even though the full-service carrier recorded operating revenues worth ₹2,994.38 crore, its expenses stood at ₹3,894.85 crore. In the fiscal FY19, the airline had posted losses of ₹516 crore. AirAsia India, in which Tata Sons holds a 51 per cent stake and AirAsia Bhd the remaining 49 per cent, has incurred losses of ₹703 crore. In FY19, the airline recorded losses worth ₹141 crore. During the period under review, SpiceJet posted losses of ₹266 crore, as against a profit of ₹521 crore the previous fiscal. Another low-cost carrier , IndiGo, posted losses of ₹490 crore (profit of ₹2,576 crore in FY19). While no-frills carrier GoAir did not make any losses during the period, its revenues","Dec 27, 2019",https://www.thehindubusinessline.com/economy/logistics/4-year-high-airlines-april-nov-losses-at-6845-cr/article30405073.ece
15,Real Matters’ 282% rally leads Canadian stocks this year -  BNN Bloomberg,. BNN. TECHNOLOGY. . Banks don't control any part of their business model: Dick Bove. . TECHNOLOGY. News Wire. Investing.,"    Latest Videos  This doesn't make any sense to us: CFIB CEO on Ontario restrictions Hedge funds see healthcare as an active sector in 2021: TD Securities' Mithra Warrier BNN Bloomberg's closing bell update: December 18, 2020                                                                                                  Dec 27, 2019  Divya Balji, Bloomberg News With two trading days left until the end of the year, Canada’s benchmark stock index is on pace for its best run in a decade. After hitting 59 fresh highs, the S&P/TSX Composite Index has climbed about 23% this year, weathering everything investors could throw at the market: volatile commodity prices; the unpredictability of U.S.-China trade tensions; Canada’s fractious federal election; heightened recession fears and persistent profit concerns. Here’s a look at some of the biggest winners and losers in Canada’s equity market this year. Investor Darling Real Matters Inc., a provider of network services for the mortgage and insurance industries, is the biggest gainer so far this year with a 282% surge. The rally has pushed the Markham, Ontario-based company’s market value beyond the $1 billion (US$819 million) mark. Last month, National Bank Financial upgraded the stock to outperform and said it “did not give enough respect to the correlation of Real Matters business with the market volumes for mortgages.” The rotation from value to growth this year has been good for tech stocks, making them the country’s best performing group by a mile. The S&P/TSX Info Tech Index has gained more than 65% this year, adding about $58 billion (US$45 billion) in value. Shopify Inc., the subject of some takeover speculation, is up 183% so far in 2019, the top tech stock and the second-best overall performer on the broader index. Investors have rewarded the Ottawa-based company’s rapid sales growth and its plans to spend US$1 billion to set up a network","Dec 27, 2019",http://www.bnnbloomberg.ca/real-matters-282-rally-leads-canadian-stocks-this-year-1.1367141
16,"Alibaba becomes most valuable Asian company as market cap tops $500bn -
                        Nikkei Asia",Alibaba becomes most valuable Asian company as market cap tops $500bn. READ NEXT. Alibaba's Hong Kong shares soar over 7%,"Samsung and TSMC surged in 2019; Indian automakers and SE Asian airlines slumped SINGAPORE -- Asian tech companies' market caps have grown significantly this year as the tech cycle turned up and investors began pricing in economic recoveries, factors that moved the market capitalization of Chinese internet giant Alibaba Group Holding to well over $500 billion. With recession fears having been dispelled and lower interest rates prevailing globally, analysts say equities will attract more investments next year and that the valuations of Asia's leading tech companies could reach higher. The Nikkei Asian Review compared Asian companies' market caps as of Dec. 20 with where they were at the end of 2018 in dollar terms. New York-listed Alibaba's market value grew to $570 billion in that period, making the company Asia's No. 1 by that measure for the first time since it listed in 2014. Globally, Alibaba had the seventh highest valuation between Facebook ($588 billion) and Berkshire Hathaway ($554 billion). Its market value grew 60%, far above Amazon.com's 20% and Google parent Alphabet's 29%. ""[China's] continually growing real disposable income, with more new cities stepping up the tier-system ladder, has been positively contributing to Alibaba's stock performance,"" said Ivan Platonov, an analyst at Beijing-based consultancy EqualOcean. He also said retail -- Alibaba's biggest revenue generator so far -- is not extremely vulnerable to the recent trade tussles, unlike hardware, logistics and other sectors. ""Global investors,"" Platonov said, ""are seemingly buying into this story."" In Alibaba's secondary listing in Hong Kong in November, investors rushed to buy more than $11 billion worth of shares in an offering that was oversubscribed multiple times. Tencent Holdings, Asia's market cap leader for 2018, grew 20% through Dec. 20 but fell to No. 2 due to weaker ad sales, themselves the victim of the rising popularity of social-media upstart ByteDance, which operates TikTok. Tencent also suffered from regulatory headaches in its core gaming business, with Beijing approving fewer titles this year and imposing tougher restrictions on minors' playing hours. A rising star in the Chinese tech sector was Meituan Dianping, a Tencent-backed super app whose market value more than doubled to $76 billion during 2019. A nascent trend toward healthy light meals, beverages and nighttime snacks drove profitability at its core food delivery service. As for tech sector manufacturers, semiconductor producers gained big as the tech cycle bottomed out. Samsung Electronics jumped 39% this year","Dec 26, 2019",https://asia.nikkei.com/Business/Markets/Alibaba-becomes-most-valuable-Asian-company-as-market-cap-tops-500bn
17,What will 2020 hold for companies? | Financial Times,Cookies on FT Sites. What will 2020 hold for companies?. Green finance rises up banks’ agendas. Recommended. Big tech buoyant,"STEER FROM CRISIS TO
RECOVERY WITH THE FT FT reporters When 2019 began, risk factors filled the horizon for many of the world’s banks, writes Patrick Jenkins. US-China trade tensions, the rising threat of competition from big technology groups, ultra-low interest rates and the cloud of Brexit all damped expectations for the year ahead. There was little relief on any of those issues. But the year still turned out pretty well for global banks. The Dow Jones US Banks Index rose by a third. And even in Europe, where the environment has steadily worsened, bank sentiment has improved: the Euro Stoxx Banks Index rose 8 per cent. So what will 2020 bring? To an extent, the macroeconomic picture may improve. US president Donald Trump is likely to want to unveil triumphant trade deals, particularly with China, ahead of the US election at the end of the year. Brexit, if not yet “done”, in the words of UK prime minister Boris Johnson, is at least more on track for delivery than under the country’s last more fractured parliament. Given the large new Conservative majority, financiers hope Mr Johnson will be able to negotiate a softer Brexit than would have been the case when the extreme wing of his party was pushing for a “no deal”. That would minimise the disruption to the City of London and also protect the broader European economy. Mr Johnson’s enlarged power base may also have concrete ramifications for the UK’s remaining majority state-owned bank, RBS, which bankers forecast will be a candidate for swift reprivatisation. Aside from the idiosyncratic, there is a general view that two large topics will dominate the agendas of global banks this year: green finance and technology. “The focus on sustainable finance is very much a positive trend,” said Laurie Mayers, associate management director at Moody’s, the rating agency. “European banks are very much committed to doing what they can to help sectors transition.” Huw van Steenis, a senior adviser at UBS, agreed. “Greening the financial system is going to become a top issue for banks in 2020.”  Mr van Steenis, who was previously an adviser to Mark Carney, the outgoing Bank of England governor who has made climate change a central topic in the financial risk debate, says lenders will be making a priority of stepping up climate-related risk management and disclosures. On technology, the vast sums expended to maintain creaking","Dec 27, 2019",https://www.ft.com/content/65784240-1ff8-11ea-92da-f0c92e957a96
18,Access to this page has been denied.,Please verify you are a human. ,"Access to this page has been denied because we believe you are using automation tools to browse the website. This may happen as a result of the following: Please make sure that Javascript and cookies are enabled on your browser and that you are not blocking them from loading. Reference ID: #18c96300-4245-11eb-b66c-212ef344c17a Powered by PerimeterX , Inc.","Dec 27, 2019",https://www.investors.com/news/rite-aid-stock-continues-epic-run-triples-in-week/
19,How to Beat Pesky Fees | Kiplinger,"Save up to 67%. How to Beat Pesky Fees. No matter how much you try to swat them away, pesky","Getty Images No matter how much you try to swat them away, pesky fees keep nibbling at your travel bookings, wireless plans, bank accounts, investments and pretty much every other part of your financial life. Although the fees may not seem like much on their own, they can add up to hundreds or even thousands of dollars a year, putting a big dent in your wallet. Here, we’ve listed common fees in five categories, plus ways to eliminate or reduce them. Some of the fees are legitimate—professionals such as investment advisers and real estate brokers deserve compensation, after all. But if you’re overpaying for a service, you can make moves to tug down the rate. And with some preparation and knowledge, you can wipe out the most irritating charges. 1 of 14 Getty Images Southwest Airlines doesn’t charge seat-selection fees and lets passengers choose their seats as they board. But the airline assigns your place in line based on when you check in, so the farther back you are, the less likely you’ll get the seat you want. (The EarlyBird boarding fee of $15 to $25 per flight gives you priority.) Check in to your flight online as early as possible to help boost your boarding position. 2 of 14 Getty Images Generally, carry-on bags are free with the biggest U.S. airlines. But note that if you have a basic economy ticket with United, you may be charged a checked-bag fee plus a $25 “gate handling charge” if you bring a full-size carry-on bag to the gate. Discount carriers such as Frontier and Spirit charge for carry-on bags, and the fees are often lowest if you pay them when you book. Plus, you may pay more to take a bag into the cabin than to check it. For a mid-February flight from Atlanta to New York City, for example, Spirit recently charged $33 if you paid for a carry-on bag when reserving your flight but $28 for a checked bag. 3 of 14 Getty Images How to beat them: Resort fees, which some hotels add on to guests’ regular nightly rate for amenities (whether or not you use them), are under fire. Both Marriott International and Hilton are facing lawsuits that, if successful, may cause hotels to ditch the fees or disclose them more prominently, and a bill proposed in the U.S. House of Representatives would require the fees to","Dec 27, 2019",https://www.kiplinger.com/slideshow/spending/t062-s003-how-to-beat-paying-pesky-fees/index.html
